id,date,platform,category,text,hashtags,likes,replies
1,2024-11-03,Twitter,saree,The plain design feels outdated to me.,#kurtistyle #ootd #trendalert #ethnicwear,203,211
2,2025-06-16,Pinterest,hoodie,This linen hoodie might become popular soon.,#minimalstyle #ethnicwear #pastelfashion,170,13
3,2025-11-22,Amazon,jacket,This striped jacket seems to be trending this season.,#fashiondaily #streetwear #outfitinspo #summerfashion #ethnicwear,4959,270
4,2024-07-23,Twitter,handbag,This dark handbag is trending everywhere right now.,#streetwear #oversizedhoodie #outfitinspo,4923,108
5,2025-03-24,Amazon,handbag,Seeing lots of beige handbag styles on social media recently.,#outfitinspo #styleblog,2120,153
6,2025-10-06,Pinterest,saree,This striped saree looks stunning and the denim quality is great.,#styleblog #summerfashion,1492,298
7,2024-06-09,Twitter,dress,This embroidered dress seems to be trending this season.,#outfitinspo #fashiondaily #streetwear #pastelfashion #kurtistyle #oversizedhoodie,178,287
8,2025-10-27,Instagram,handbag,The handbag looks good but the wool quality feels cheap.,#winterstyle #streetwear #ootd,3883,16
9,2025-10-01,Reddit,hoodie,The fabric of this hoodie wrinkles too easily.,#trendalert #ootd,3467,139
10,2025-02-07,Instagram,kurti,Seeing lots of white kurti styles on social media recently.,#trendalert #pastelfashion,2638,56
11,2024-03-25,Twitter,streetwear,Fashion influencers are posting about slim fit streetwear again.,#streetwear #kurtistyle,1676,129
12,2024-01-25,Myntra,hoodie,Totally obsessed with this slim fit hoodie. Perfect for everyday outfits.,#kurtistyle #winterstyle #summerfashion,4678,74
13,2024-04-14,Twitter,streetwear,The streetwear looks good but the wool quality feels cheap.,#outfitinspo #pastelfashion #fashiondaily #summerfashion,1479,85
14,2025-07-25,Instagram,jacket,The wool fabric makes this jacket super comfortable.,#fashiondaily #trendalert #ethnicwear #summerfashion #minimalstyle,3293,267
15,2025-08-11,Reddit,handbag,This striped handbag seems to be trending this season.,#streetwear #trendalert #pastelfashion #minimalstyle #vintagefashion,2630,108
16,2025-08-04,Instagram,streetwear,This embroidered streetwear seems to be trending this season.,#oversizedhoodie #trendalert #vintagefashion #minimalstyle #kurtistyle #summerfashion,2951,149
17,2024-05-29,Reddit,tshirt,I really love this modern pastel tshirt. The denim material feels amazing.,#trendalert #vintagefashion #ethnicwear #oversizedhoodie #styleblog,3780,106
18,2025-06-15,Instagram,streetwear,The streetwear looks good but the linen quality feels cheap.,#denimtrend #fashiondaily #kurtistyle #trendalert,4124,64
19,2025-03-28,Myntra,kurti,Seeing lots of pink kurti styles on social media recently.,#pastelfashion #outfitinspo,2597,7
20,2025-05-17,Pinterest,jacket,Fashion influencers are posting about loose fit jacket again.,#summerfashion #ootd #streetwear,3476,227
21,2025-12-31,Instagram,tshirt,The wool fabric makes this tshirt super comfortable.,#ootd #summerfashion #fashiondaily,2081,71
22,2025-11-20,Amazon,streetwear,The fabric of this streetwear wrinkles too easily.,#denimtrend #oversizedhoodie,1812,27
23,2025-04-26,Pinterest,dress,This plain dress seems to be trending this season.,#pastelfashion #fashiondaily #oversizedhoodie,1871,274
24,2024-09-02,Instagram,kurti,This polyester kurti might become popular soon.,#outfitinspo #streetwear #winterstyle #vintagefashion #styleblog #ethnicwear,4164,298
25,2025-09-28,Twitter,handbag,This printed handbag looks stunning and the polyester quality is great.,#fashiondaily #ethnicwear #streetwear #trendalert #ootd #pastelfashion,4163,101
26,2025-12-03,Instagram,tshirt,This printed tshirt looks stunning and the polyester quality is great.,#ootd #pastelfashion,170,183
27,2025-05-20,Instagram,saree,This pastel saree looked better online than in real life.,#pastelfashion #winterstyle #oversizedhoodie,1328,213
28,2024-03-01,Amazon,kurti,The kurti looks good but the denim quality feels cheap.,#winterstyle #ootd #denimtrend #fashiondaily #streetwear #summerfashion,1108,30
29,2025-01-04,Reddit,dress,I noticed many people wearing oversized dress lately.,#denimtrend #summerfashion #streetwear #winterstyle #styleblog #ethnicwear,2099,82
30,2024-02-13,Pinterest,kurti,Seeing lots of neon kurti styles on social media recently.,#ootd #oversizedhoodie,2596,38
31,2024-02-02,Twitter,kurti,This embroidered kurti looks stunning and the linen quality is great.,#minimalstyle #outfitinspo #fashiondaily,2105,299
32,2025-12-28,Myntra,hoodie,This wool hoodie might become popular soon.,#ootd #fashiondaily,1651,147
33,2025-09-29,Reddit,saree,I really love this oversized blue saree. The wool material feels amazing.,#oversizedhoodie #pastelfashion #vintagefashion #streetwear #denimtrend #trendalert,3373,150
34,2025-02-24,Myntra,hoodie,The polyester fabric makes this hoodie super comfortable.,#denimtrend #summerfashion #kurtistyle #oversizedhoodie #ootd,2319,167
35,2025-12-12,Pinterest,streetwear,The cotton fabric makes this streetwear super comfortable.,#ootd #oversizedhoodie,1545,247
36,2025-05-28,Myntra,streetwear,This floral streetwear looks stunning and the cotton quality is great.,#winterstyle #kurtistyle #ootd #pastelfashion #outfitinspo,3060,247
37,2025-07-29,Myntra,saree,I really love this slim fit dark saree. The cotton material feels amazing.,#summerfashion #vintagefashion,4077,295
38,2024-07-13,Reddit,saree,This printed saree seems to be trending this season.,#trendalert #styleblog #minimalstyle #fashiondaily #ethnicwear,4070,115
39,2024-09-09,Twitter,hoodie,I really love this oversized blue hoodie. The cotton material feels amazing.,#kurtistyle #fashiondaily,3899,186
40,2025-12-15,Twitter,jacket,I expected better from this loose fit jacket. Not very comfortable.,#oversizedhoodie #ethnicwear,356,42
41,2025-09-26,Reddit,saree,This floral saree looks stunning and the linen quality is great.,#ethnicwear #oversizedhoodie #ootd,526,199
42,2024-07-31,Myntra,saree,This floral saree seems to be trending this season.,#fashiondaily #winterstyle #styleblog #vintagefashion,3616,234
43,2024-01-20,Myntra,hoodie,This embroidered hoodie looks stunning and the polyester quality is great.,#minimalstyle #denimtrend,2959,91
44,2025-03-06,Myntra,jacket,This blue jacket looked better online than in real life.,#summerfashion #styleblog #winterstyle #denimtrend #kurtistyle #vintagefashion,1797,199
45,2025-10-03,Myntra,saree,This embroidered saree looks stunning and the linen quality is great.,#pastelfashion #ootd #denimtrend #trendalert,3843,121
46,2024-06-10,Twitter,jacket,This white jacket looked better online than in real life.,#minimalstyle #vintagefashion #denimtrend,4021,271
47,2024-05-14,Reddit,handbag,Seeing lots of white handbag styles on social media recently.,#trendalert #pastelfashion #streetwear #ethnicwear,4694,269
48,2025-02-27,Reddit,streetwear,This cotton streetwear might become popular soon.,#vintagefashion #denimtrend #summerfashion #trendalert #streetwear #pastelfashion,579,115
49,2025-12-15,Reddit,handbag,The denim fabric makes this handbag super comfortable.,#fashiondaily #winterstyle #outfitinspo #denimtrend #vintagefashion #trendalert,963,189
50,2024-06-14,Twitter,tshirt,I really love this loose fit green tshirt. The linen material feels amazing.,#denimtrend #kurtistyle #ethnicwear,3778,54
51,2024-05-01,Reddit,tshirt,Fashion influencers are posting about vintage tshirt again.,#minimalstyle #summerfashion,4928,269
52,2024-09-30,Amazon,hoodie,This dark hoodie is trending everywhere right now.,#ootd #summerfashion #minimalstyle #vintagefashion #fashiondaily #denimtrend,3294,39
53,2024-03-16,Amazon,jacket,This cotton jacket might become popular soon.,#fashiondaily #streetwear,1574,129
54,2024-05-09,Reddit,kurti,This wool kurti might become popular soon.,#vintagefashion #kurtistyle #outfitinspo #winterstyle #pastelfashion,1264,271
55,2025-06-28,Instagram,streetwear,The denim fabric makes this streetwear super comfortable.,#ootd #fashiondaily #vintagefashion #kurtistyle,4836,257
56,2024-09-03,Pinterest,streetwear,This silk streetwear might become popular soon.,#trendalert #ethnicwear #winterstyle #summerfashion #kurtistyle,2227,29
57,2025-07-04,Twitter,streetwear,Seeing lots of dark streetwear styles on social media recently.,#oversizedhoodie #styleblog,167,212
58,2024-08-29,Pinterest,jacket,I really love this slim fit pink jacket. The wool material feels amazing.,#ethnicwear #outfitinspo #pastelfashion #denimtrend #ootd,3055,246
59,2025-10-22,Twitter,handbag,Seeing lots of beige handbag styles on social media recently.,#kurtistyle #ethnicwear,1265,63
60,2024-08-10,Myntra,kurti,The printed design feels outdated to me.,#oversizedhoodie #kurtistyle,156,254
61,2024-03-26,Twitter,handbag,I really love this minimal dark handbag. The linen material feels amazing.,#fashiondaily #oversizedhoodie #vintagefashion,4932,79
62,2025-02-09,Instagram,hoodie,The fabric of this hoodie wrinkles too easily.,#trendalert #oversizedhoodie #styleblog #vintagefashion,4399,20
63,2024-08-31,Myntra,jacket,This blue jacket is trending everywhere right now.,#ootd #vintagefashion #oversizedhoodie #outfitinspo #kurtistyle #ethnicwear,3771,253
64,2025-07-12,Reddit,dress,The fabric of this dress wrinkles too easily.,#outfitinspo #pastelfashion #summerfashion #styleblog #kurtistyle #streetwear,3380,94
65,2024-02-26,Twitter,saree,I expected better from this vintage saree. Not very comfortable.,#trendalert #oversizedhoodie #outfitinspo #vintagefashion #pastelfashion,458,216
66,2024-06-24,Instagram,handbag,This printed handbag looks stunning and the silk quality is great.,#kurtistyle #streetwear #trendalert #vintagefashion #ethnicwear,608,139
67,2024-03-28,Myntra,streetwear,The polyester fabric makes this streetwear super comfortable.,#styleblog #streetwear,1987,159
68,2024-05-26,Twitter,hoodie,Totally obsessed with this oversized hoodie. Perfect for everyday outfits.,#styleblog #trendalert #oversizedhoodie #vintagefashion,2632,112
69,2024-05-21,Instagram,kurti,This neon kurti looked better online than in real life.,#ethnicwear #oversizedhoodie #trendalert #ootd #denimtrend #vintagefashion,1076,259
70,2025-04-25,Myntra,jacket,The plain design feels outdated to me.,#outfitinspo #ootd #summerfashion #streetwear #ethnicwear,131,299
71,2024-09-09,Amazon,kurti,The plain design feels outdated to me.,#outfitinspo #kurtistyle,2732,199
72,2025-07-22,Instagram,handbag,This green handbag is trending everywhere right now.,#ootd #styleblog #fashiondaily,3174,47
73,2025-10-01,Amazon,dress,I noticed many people wearing modern dress lately.,#summerfashion #pastelfashion #streetwear,2319,210
74,2025-03-24,Instagram,streetwear,The plain design feels outdated to me.,#summerfashion #styleblog,1979,119
75,2025-05-02,Pinterest,kurti,This neon kurti is trending everywhere right now.,#minimalstyle #summerfashion #streetwear #vintagefashion,3152,45
76,2025-12-06,Instagram,streetwear,The fabric of this streetwear wrinkles too easily.,#minimalstyle #kurtistyle #fashiondaily #ethnicwear #vintagefashion #pastelfashion,2556,191
77,2024-07-08,Reddit,handbag,This embroidered handbag seems to be trending this season.,#pastelfashion #fashiondaily #denimtrend #summerfashion,4020,150
78,2024-12-27,Reddit,hoodie,This floral hoodie looks stunning and the denim quality is great.,#outfitinspo #summerfashion #ootd #fashiondaily #ethnicwear,2058,231
79,2024-02-26,Pinterest,dress,This embroidered dress looks stunning and the silk quality is great.,#fashiondaily #winterstyle #pastelfashion,3222,48
80,2025-12-27,Pinterest,handbag,This black handbag is trending everywhere right now.,#oversizedhoodie #outfitinspo #vintagefashion,3624,36
81,2024-12-06,Amazon,tshirt,I noticed many people wearing minimal tshirt lately.,#oversizedhoodie #denimtrend #trendalert #kurtistyle #ethnicwear #ootd,836,95
82,2025-06-06,Pinterest,kurti,Seeing lots of pink kurti styles on social media recently.,#fashiondaily #ethnicwear,2594,121
83,2024-11-20,Twitter,streetwear,I noticed many people wearing modern streetwear lately.,#summerfashion #minimalstyle #trendalert,947,290
84,2024-10-04,Twitter,dress,The cotton fabric makes this dress super comfortable.,#vintagefashion #outfitinspo #denimtrend,2807,62
85,2025-02-07,Instagram,kurti,This white kurti is trending everywhere right now.,#summerfashion #minimalstyle #oversizedhoodie,1505,112
86,2024-05-23,Instagram,dress,This wool dress might become popular soon.,#fashiondaily #ethnicwear #winterstyle,489,192
87,2024-11-14,Pinterest,dress,The wool fabric makes this dress super comfortable.,#trendalert #outfitinspo #vintagefashion #winterstyle #ethnicwear #pastelfashion,3323,161
88,2024-04-12,Pinterest,handbag,This striped handbag looks stunning and the silk quality is great.,#kurtistyle #styleblog #streetwear,2541,136
89,2025-08-08,Pinterest,dress,The silk fabric makes this dress super comfortable.,#ethnicwear #streetwear #minimalstyle #styleblog,4649,114
90,2024-01-31,Instagram,dress,This white dress looked better online than in real life.,#vintagefashion #trendalert #styleblog #outfitinspo #ethnicwear,1360,265
91,2025-12-30,Instagram,dress,Fashion influencers are posting about minimal dress again.,#kurtistyle #ootd #streetwear,2324,262
92,2024-10-11,Amazon,saree,I really love this vintage black saree. The silk material feels amazing.,#oversizedhoodie #pastelfashion #fashiondaily #trendalert #winterstyle #ethnicwear,448,257
93,2024-05-11,Instagram,jacket,I expected better from this minimal jacket. Not very comfortable.,#oversizedhoodie #trendalert #winterstyle #denimtrend #summerfashion,4867,35
94,2025-10-06,Amazon,streetwear,Totally obsessed with this modern streetwear. Perfect for everyday outfits.,#outfitinspo #minimalstyle #pastelfashion #ootd #streetwear,3486,160
95,2025-07-21,Amazon,tshirt,Totally obsessed with this oversized tshirt. Perfect for everyday outfits.,#winterstyle #summerfashion #oversizedhoodie #pastelfashion #fashiondaily #ootd,2708,63
96,2025-02-20,Pinterest,tshirt,This denim tshirt might become popular soon.,#vintagefashion #ethnicwear #winterstyle #denimtrend,4454,28
97,2024-11-14,Reddit,streetwear,The fabric of this streetwear wrinkles too easily.,#denimtrend #oversizedhoodie #kurtistyle,1248,232
98,2024-02-24,Myntra,streetwear,This pastel streetwear looked better online than in real life.,#kurtistyle #pastelfashion #vintagefashion #summerfashion #minimalstyle,1421,6
99,2024-06-25,Pinterest,kurti,I really love this slim fit blue kurti. The denim material feels amazing.,#vintagefashion #trendalert #oversizedhoodie #streetwear,4013,227
100,2024-06-06,Pinterest,kurti,Seeing lots of pastel kurti styles on social media recently.,#fashiondaily #winterstyle,4444,198
101,2025-01-02,Instagram,streetwear,The floral design feels outdated to me.,#ootd #ethnicwear #vintagefashion,2489,6
102,2024-05-31,Twitter,saree,I really love this modern green saree. The linen material feels amazing.,#winterstyle #summerfashion #ootd #kurtistyle,168,276
103,2025-11-15,Myntra,dress,The denim fabric makes this dress super comfortable.,#minimalstyle #styleblog #kurtistyle #fashiondaily,1531,19
104,2025-01-12,Myntra,jacket,I expected better from this modern jacket. Not very comfortable.,#fashiondaily #summerfashion #outfitinspo,1656,9
105,2025-02-05,Instagram,streetwear,I really love this minimal white streetwear. The denim material feels amazing.,#ootd #fashiondaily #styleblog #minimalstyle,232,37
106,2024-10-05,Amazon,handbag,I expected better from this minimal handbag. Not very comfortable.,#kurtistyle #denimtrend #oversizedhoodie #fashiondaily #streetwear #ethnicwear,2242,61
107,2024-01-09,Myntra,tshirt,This linen tshirt might become popular soon.,#oversizedhoodie #trendalert #vintagefashion #kurtistyle,4789,22
108,2024-08-04,Instagram,hoodie,I noticed many people wearing loose fit hoodie lately.,#ootd #pastelfashion #trendalert #outfitinspo #ethnicwear #kurtistyle,98,17
109,2025-10-15,Pinterest,saree,I really love this loose fit pastel saree. The linen material feels amazing.,#styleblog #winterstyle #ethnicwear #fashiondaily #pastelfashion,1947,42
110,2024-09-27,Instagram,jacket,This embroidered jacket seems to be trending this season.,#streetwear #styleblog #oversizedhoodie #denimtrend,1403,38
111,2025-03-06,Pinterest,streetwear,The fabric of this streetwear wrinkles too easily.,#minimalstyle #ootd #summerfashion #trendalert #denimtrend,1480,141
112,2025-08-07,Reddit,jacket,This printed jacket looks stunning and the cotton quality is great.,#outfitinspo #ethnicwear #ootd #oversizedhoodie,4303,189
113,2025-11-01,Myntra,saree,Totally obsessed with this loose fit saree. Perfect for everyday outfits.,#denimtrend #styleblog #oversizedhoodie #fashiondaily #trendalert,3080,127
114,2024-01-19,Reddit,handbag,This striped handbag seems to be trending this season.,#oversizedhoodie #streetwear,3125,101
115,2025-04-22,Myntra,tshirt,Fashion influencers are posting about slim fit tshirt again.,#winterstyle #fashiondaily #styleblog #vintagefashion #summerfashion,599,93
116,2025-04-07,Reddit,streetwear,The fabric of this streetwear wrinkles too easily.,#ethnicwear #styleblog #denimtrend #kurtistyle #pastelfashion,1283,167
117,2025-07-26,Myntra,streetwear,The striped design feels outdated to me.,#styleblog #ootd #streetwear #ethnicwear #oversizedhoodie,4991,63
118,2025-09-28,Twitter,tshirt,The silk fabric makes this tshirt super comfortable.,#outfitinspo #kurtistyle #oversizedhoodie #trendalert #ethnicwear #winterstyle,4340,289
119,2024-05-05,Myntra,hoodie,The hoodie looks good but the linen quality feels cheap.,#kurtistyle #pastelfashion #oversizedhoodie,64,69
120,2024-12-28,Pinterest,saree,The embroidered design feels outdated to me.,#kurtistyle #ootd #fashiondaily #pastelfashion #winterstyle,302,16
121,2024-12-21,Reddit,kurti,This green kurti is trending everywhere right now.,#oversizedhoodie #trendalert #ootd #fashiondaily,4225,153
122,2024-05-21,Myntra,tshirt,The plain design feels outdated to me.,#vintagefashion #kurtistyle,304,291
123,2024-05-27,Pinterest,handbag,The denim fabric makes this handbag super comfortable.,#winterstyle #kurtistyle,4568,229
124,2024-09-30,Myntra,kurti,This neon kurti looked better online than in real life.,#vintagefashion #denimtrend #fashiondaily #summerfashion #minimalstyle #ootd,3343,173
125,2024-04-25,Instagram,saree,Seeing lots of white saree styles on social media recently.,#summerfashion #minimalstyle,240,295
126,2024-07-16,Reddit,streetwear,This embroidered streetwear looks stunning and the cotton quality is great.,#minimalstyle #vintagefashion #streetwear #trendalert,543,268
127,2024-12-07,Reddit,kurti,I noticed many people wearing minimal kurti lately.,#outfitinspo #ethnicwear #minimalstyle,3551,120
128,2025-09-11,Reddit,hoodie,The fabric of this hoodie wrinkles too easily.,#pastelfashion #trendalert #summerfashion #minimalstyle #kurtistyle,2583,21
129,2025-08-21,Twitter,tshirt,This green tshirt looked better online than in real life.,#vintagefashion #denimtrend #summerfashion #oversizedhoodie #minimalstyle,1165,227
130,2024-02-29,Pinterest,kurti,The fabric of this kurti wrinkles too easily.,#summerfashion #kurtistyle #streetwear #pastelfashion,2009,124
131,2025-01-02,Myntra,kurti,The embroidered design feels outdated to me.,#streetwear #vintagefashion #winterstyle,753,258
132,2024-09-23,Pinterest,streetwear,I really love this vintage white streetwear. The wool material feels amazing.,#pastelfashion #ootd #kurtistyle #styleblog,1791,132
133,2024-08-22,Twitter,jacket,Seeing lots of black jacket styles on social media recently.,#fashiondaily #trendalert #minimalstyle,4492,34
134,2024-11-07,Pinterest,jacket,Totally obsessed with this modern jacket. Perfect for everyday outfits.,#winterstyle #fashiondaily #trendalert #summerfashion #minimalstyle,4363,269
135,2024-02-20,Amazon,tshirt,This plain tshirt seems to be trending this season.,#fashiondaily #ethnicwear,2843,220
136,2024-05-07,Reddit,tshirt,I noticed many people wearing minimal tshirt lately.,#pastelfashion #summerfashion,2378,4
137,2024-06-07,Amazon,saree,This wool saree might become popular soon.,#trendalert #summerfashion #ootd #outfitinspo #winterstyle,166,42
138,2025-07-13,Amazon,jacket,This striped jacket looks stunning and the polyester quality is great.,#trendalert #summerfashion,1133,78
139,2024-10-27,Myntra,saree,I noticed many people wearing loose fit saree lately.,#minimalstyle #outfitinspo #ethnicwear #denimtrend,3481,16
140,2025-12-19,Pinterest,handbag,I expected better from this slim fit handbag. Not very comfortable.,#minimalstyle #trendalert #oversizedhoodie #ethnicwear #denimtrend,1123,142
141,2024-11-18,Instagram,kurti,This neon kurti is trending everywhere right now.,#pastelfashion #minimalstyle #ootd #trendalert #fashiondaily,3756,121
142,2024-04-08,Myntra,jacket,Seeing lots of pastel jacket styles on social media recently.,#kurtistyle #ethnicwear #minimalstyle #denimtrend #ootd,4409,41
143,2025-10-14,Pinterest,hoodie,The wool fabric makes this hoodie super comfortable.,#oversizedhoodie #ootd #trendalert #streetwear,232,57
144,2024-08-12,Myntra,jacket,The fabric of this jacket wrinkles too easily.,#minimalstyle #ootd #summerfashion #pastelfashion #styleblog #streetwear,1634,255
145,2025-04-10,Amazon,kurti,I expected better from this slim fit kurti. Not very comfortable.,#fashiondaily #streetwear #denimtrend #kurtistyle #summerfashion,2147,157
146,2024-06-30,Pinterest,saree,The striped design feels outdated to me.,#denimtrend #minimalstyle #outfitinspo,91,29
147,2025-12-16,Myntra,hoodie,This polyester hoodie might become popular soon.,#oversizedhoodie #outfitinspo #ethnicwear,811,90
148,2025-09-15,Twitter,saree,This pink saree looked better online than in real life.,#styleblog #trendalert #pastelfashion,3759,220
149,2025-04-22,Twitter,handbag,Totally obsessed with this minimal handbag. Perfect for everyday outfits.,#ootd #streetwear #kurtistyle,3943,208
150,2024-04-29,Amazon,hoodie,This printed hoodie seems to be trending this season.,#kurtistyle #outfitinspo #ethnicwear #minimalstyle #ootd #fashiondaily,962,116
151,2024-03-30,Instagram,handbag,The handbag looks good but the cotton quality feels cheap.,#winterstyle #vintagefashion #styleblog #denimtrend #outfitinspo #pastelfashion,604,69
152,2024-03-10,Twitter,tshirt,I noticed many people wearing loose fit tshirt lately.,#denimtrend #minimalstyle #ootd #streetwear #fashiondaily #pastelfashion,2882,90
153,2024-04-01,Instagram,streetwear,Fashion influencers are posting about oversized streetwear again.,#trendalert #denimtrend #oversizedhoodie #streetwear #pastelfashion #summerfashion,2949,228
154,2025-08-04,Reddit,saree,This dark saree looked better online than in real life.,#ethnicwear #outfitinspo #trendalert #styleblog #summerfashion,3184,278
155,2025-11-05,Pinterest,jacket,Fashion influencers are posting about modern jacket again.,#vintagefashion #kurtistyle #ethnicwear,554,299
156,2024-07-22,Amazon,saree,The fabric of this saree wrinkles too easily.,#streetwear #vintagefashion #ethnicwear,3556,222
157,2024-12-09,Twitter,hoodie,This beige hoodie looked better online than in real life.,#kurtistyle #pastelfashion #fashiondaily,3658,28
158,2025-06-24,Twitter,hoodie,This embroidered hoodie looks stunning and the denim quality is great.,#fashiondaily #streetwear #ootd #outfitinspo,3696,271
159,2024-12-31,Instagram,tshirt,Fashion influencers are posting about loose fit tshirt again.,#fashiondaily #outfitinspo #styleblog,315,299
160,2025-02-25,Amazon,saree,The printed design feels outdated to me.,#pastelfashion #minimalstyle #vintagefashion,3980,115
161,2024-03-30,Instagram,tshirt,Seeing lots of pink tshirt styles on social media recently.,#fashiondaily #ootd,3486,157
162,2024-09-14,Twitter,hoodie,This beige hoodie is trending everywhere right now.,#minimalstyle #outfitinspo,4121,66
163,2025-11-19,Reddit,saree,I really love this modern pastel saree. The linen material feels amazing.,#vintagefashion #kurtistyle #winterstyle #streetwear,635,258
164,2024-01-28,Myntra,hoodie,This pastel hoodie looked better online than in real life.,#trendalert #streetwear #styleblog #ethnicwear #ootd,330,27
165,2024-11-24,Reddit,jacket,Seeing lots of white jacket styles on social media recently.,#denimtrend #fashiondaily #pastelfashion,2921,4
166,2025-06-10,Myntra,saree,This dark saree looked better online than in real life.,#oversizedhoodie #pastelfashion #styleblog #minimalstyle #streetwear #ethnicwear,1871,296
167,2024-09-08,Instagram,hoodie,This green hoodie looked better online than in real life.,#denimtrend #trendalert #oversizedhoodie #kurtistyle #pastelfashion,3043,82
168,2025-07-26,Pinterest,jacket,Totally obsessed with this modern jacket. Perfect for everyday outfits.,#ethnicwear #pastelfashion #styleblog #vintagefashion #ootd,4565,189
169,2025-11-14,Myntra,tshirt,This green tshirt looked better online than in real life.,#streetwear #fashiondaily,841,215
170,2025-04-23,Myntra,hoodie,The plain design feels outdated to me.,#outfitinspo #winterstyle #fashiondaily #oversizedhoodie,2950,251
171,2024-01-14,Reddit,kurti,This floral kurti looks stunning and the cotton quality is great.,#outfitinspo #streetwear #summerfashion #fashiondaily #trendalert,295,174
172,2025-10-16,Instagram,tshirt,The fabric of this tshirt wrinkles too easily.,#oversizedhoodie #kurtistyle #ootd #fashiondaily #outfitinspo,4652,72
173,2024-08-29,Pinterest,saree,This floral saree seems to be trending this season.,#vintagefashion #minimalstyle #winterstyle #oversizedhoodie #ootd #outfitinspo,4608,259
174,2025-12-23,Pinterest,tshirt,The striped design feels outdated to me.,#trendalert #styleblog #denimtrend #pastelfashion,1221,78
175,2024-11-22,Reddit,streetwear,The fabric of this streetwear wrinkles too easily.,#ootd #ethnicwear #streetwear #styleblog,413,15
176,2025-06-28,Instagram,kurti,The fabric of this kurti wrinkles too easily.,#winterstyle #ethnicwear #trendalert #oversizedhoodie,1859,165
