id,date,platform,category,text,hashtags,likes,replies
529,2025-02-09,Reddit,handbag,This striped handbag seems to be trending this season.,#summerfashion #fashiondaily #winterstyle #styleblog #streetwear #kurtistyle,1032,205
530,2024-10-14,Twitter,kurti,This denim kurti might become popular soon.,#ootd #pastelfashion #fashiondaily #ethnicwear,722,263
531,2024-10-24,Myntra,hoodie,This pink hoodie is trending everywhere right now.,#denimtrend #vintagefashion #ethnicwear,1998,140
532,2024-04-30,Instagram,dress,This white dress looked better online than in real life.,#summerfashion #trendalert #kurtistyle #minimalstyle #winterstyle,3613,36
533,2024-11-02,Pinterest,streetwear,I expected better from this minimal streetwear. Not very comfortable.,#denimtrend #winterstyle #summerfashion #vintagefashion #ootd,1906,148
534,2025-01-02,Amazon,hoodie,Totally obsessed with this modern hoodie. Perfect for everyday outfits.,#minimalstyle #fashiondaily,751,227
535,2025-10-28,Myntra,dress,Seeing lots of pastel dress styles on social media recently.,#ethnicwear #pastelfashion #kurtistyle #outfitinspo #trendalert,1261,199
536,2024-07-26,Instagram,streetwear,The streetwear looks good but the denim quality feels cheap.,#trendalert #kurtistyle #summerfashion #oversizedhoodie,1957,161
537,2024-12-22,Twitter,handbag,This printed handbag seems to be trending this season.,#styleblog #streetwear,2768,94
538,2025-12-18,Myntra,dress,The embroidered design feels outdated to me.,#denimtrend #winterstyle,3871,27
539,2024-05-07,Amazon,saree,I really love this loose fit pink saree. The denim material feels amazing.,#oversizedhoodie #outfitinspo #denimtrend #ootd,1677,229
540,2025-03-21,Reddit,streetwear,The fabric of this streetwear wrinkles too easily.,#summerfashion #vintagefashion #ootd #kurtistyle,840,144
541,2025-01-22,Reddit,tshirt,The striped design feels outdated to me.,#kurtistyle #pastelfashion #winterstyle #denimtrend #minimalstyle,1339,75
542,2024-05-04,Myntra,handbag,This blue handbag looked better online than in real life.,#vintagefashion #ootd,190,277
543,2024-11-30,Twitter,jacket,I really love this oversized green jacket. The polyester material feels amazing.,#summerfashion #minimalstyle #trendalert #styleblog #outfitinspo,2201,163
544,2025-04-22,Instagram,streetwear,Totally obsessed with this slim fit streetwear. Perfect for everyday outfits.,#pastelfashion #ethnicwear #kurtistyle #vintagefashion #trendalert,2815,37
545,2024-07-20,Twitter,jacket,This embroidered jacket looks stunning and the linen quality is great.,#pastelfashion #summerfashion #minimalstyle,1987,101
546,2024-03-31,Myntra,saree,The printed design feels outdated to me.,#pastelfashion #styleblog,4764,43
547,2025-07-31,Reddit,hoodie,I expected better from this slim fit hoodie. Not very comfortable.,#denimtrend #ootd #oversizedhoodie,4175,214
548,2024-02-15,Myntra,handbag,This embroidered handbag looks stunning and the polyester quality is great.,#summerfashion #fashiondaily #vintagefashion #oversizedhoodie #trendalert #styleblog,3831,20
549,2025-08-25,Pinterest,jacket,The fabric of this jacket wrinkles too easily.,#vintagefashion #streetwear #ootd,1138,99
550,2024-12-10,Twitter,saree,Seeing lots of pink saree styles on social media recently.,#outfitinspo #streetwear #styleblog,4030,272
551,2024-07-18,Reddit,dress,This printed dress looks stunning and the silk quality is great.,#fashiondaily #summerfashion #oversizedhoodie #styleblog #ootd,3925,117
552,2024-10-24,Twitter,kurti,The striped design feels outdated to me.,#denimtrend #ethnicwear #vintagefashion #styleblog #minimalstyle,3495,50
553,2024-04-25,Instagram,dress,This embroidered dress seems to be trending this season.,#outfitinspo #minimalstyle #fashiondaily,4663,39
554,2025-06-30,Twitter,dress,Totally obsessed with this slim fit dress. Perfect for everyday outfits.,#minimalstyle #winterstyle #pastelfashion,2158,49
555,2024-11-16,Myntra,saree,The fabric of this saree wrinkles too easily.,#summerfashion #styleblog,4565,59
556,2024-12-04,Myntra,kurti,Totally obsessed with this oversized kurti. Perfect for everyday outfits.,#pastelfashion #kurtistyle #winterstyle,3216,150
557,2025-01-19,Instagram,handbag,The floral design feels outdated to me.,#denimtrend #pastelfashion #ootd #outfitinspo,686,279
558,2024-11-21,Reddit,hoodie,I noticed many people wearing modern hoodie lately.,#ootd #fashiondaily #oversizedhoodie #styleblog #pastelfashion #winterstyle,4965,157
559,2024-12-20,Amazon,hoodie,Totally obsessed with this loose fit hoodie. Perfect for everyday outfits.,#vintagefashion #summerfashion #styleblog #minimalstyle #kurtistyle,4085,165
560,2024-11-23,Myntra,handbag,I really love this slim fit dark handbag. The cotton material feels amazing.,#styleblog #fashiondaily #trendalert #oversizedhoodie #ootd #kurtistyle,4743,178
561,2025-10-23,Reddit,handbag,This embroidered handbag looks stunning and the polyester quality is great.,#vintagefashion #ethnicwear #fashiondaily #kurtistyle,3613,6
562,2025-04-28,Amazon,saree,This pastel saree looked better online than in real life.,#outfitinspo #pastelfashion #vintagefashion,2613,166
563,2024-05-24,Amazon,hoodie,I noticed many people wearing modern hoodie lately.,#kurtistyle #minimalstyle #vintagefashion #denimtrend #styleblog,3309,297
564,2025-08-04,Amazon,jacket,I really love this vintage white jacket. The polyester material feels amazing.,#ootd #pastelfashion #trendalert #streetwear,3122,41
565,2024-12-24,Pinterest,streetwear,This pastel streetwear looked better online than in real life.,#pastelfashion #vintagefashion,3290,112
566,2025-02-04,Reddit,tshirt,This polyester tshirt might become popular soon.,#outfitinspo #minimalstyle,2350,6
567,2024-05-14,Reddit,saree,This blue saree looked better online than in real life.,#pastelfashion #denimtrend #streetwear #vintagefashion #kurtistyle #oversizedhoodie,3752,196
568,2024-10-28,Twitter,kurti,The striped design feels outdated to me.,#summerfashion #pastelfashion,1158,250
569,2025-12-09,Twitter,dress,Fashion influencers are posting about loose fit dress again.,#minimalstyle #ethnicwear #outfitinspo #styleblog #denimtrend #vintagefashion,324,126
570,2024-08-17,Amazon,jacket,This denim jacket might become popular soon.,#styleblog #minimalstyle #vintagefashion #oversizedhoodie #denimtrend #streetwear,741,210
571,2024-12-01,Reddit,streetwear,This pink streetwear looked better online than in real life.,#denimtrend #trendalert #oversizedhoodie #outfitinspo #ootd,4228,285
572,2024-06-01,Twitter,handbag,The floral design feels outdated to me.,#oversizedhoodie #winterstyle #fashiondaily #styleblog #minimalstyle #ootd,2744,252
573,2025-06-25,Amazon,kurti,This plain kurti looks stunning and the silk quality is great.,#ethnicwear #minimalstyle #ootd,3210,158
574,2025-07-31,Amazon,tshirt,The fabric of this tshirt wrinkles too easily.,#oversizedhoodie #kurtistyle #pastelfashion #fashiondaily #vintagefashion #outfitinspo,4532,144
575,2024-02-19,Myntra,jacket,I noticed many people wearing minimal jacket lately.,#pastelfashion #streetwear #denimtrend #ootd,958,34
576,2025-02-25,Twitter,streetwear,The fabric of this streetwear wrinkles too easily.,#fashiondaily #styleblog #pastelfashion #ootd #streetwear #oversizedhoodie,3618,206
577,2024-04-05,Pinterest,hoodie,This polyester hoodie might become popular soon.,#streetwear #minimalstyle #pastelfashion #ootd #kurtistyle,539,294
578,2024-12-20,Myntra,dress,This dark dress looked better online than in real life.,#oversizedhoodie #denimtrend #ethnicwear #vintagefashion #minimalstyle,461,67
579,2025-10-13,Twitter,kurti,The kurti looks good but the linen quality feels cheap.,#pastelfashion #streetwear,3522,293
580,2025-09-23,Amazon,streetwear,I really love this minimal black streetwear. The denim material feels amazing.,#summerfashion #trendalert #fashiondaily #oversizedhoodie #streetwear,818,199
581,2025-04-28,Pinterest,saree,This plain saree looks stunning and the silk quality is great.,#pastelfashion #kurtistyle,2924,268
582,2025-05-09,Reddit,streetwear,This blue streetwear looked better online than in real life.,#styleblog #streetwear,2490,297
583,2025-01-14,Reddit,saree,I noticed many people wearing modern saree lately.,#minimalstyle #ootd #outfitinspo #summerfashion,3534,214
584,2025-04-25,Amazon,kurti,I really love this modern white kurti. The wool material feels amazing.,#outfitinspo #minimalstyle,1586,69
585,2025-09-04,Instagram,saree,This printed saree seems to be trending this season.,#pastelfashion #outfitinspo #minimalstyle #oversizedhoodie,1527,266
586,2025-06-04,Reddit,handbag,The floral design feels outdated to me.,#pastelfashion #minimalstyle,3478,157
587,2024-01-09,Twitter,handbag,The fabric of this handbag wrinkles too easily.,#fashiondaily #vintagefashion #oversizedhoodie #trendalert #winterstyle #ethnicwear,1671,36
588,2025-05-22,Myntra,tshirt,This blue tshirt looked better online than in real life.,#vintagefashion #fashiondaily #denimtrend #summerfashion #minimalstyle #trendalert,1516,64
589,2025-09-13,Twitter,hoodie,I really love this minimal green hoodie. The cotton material feels amazing.,#styleblog #outfitinspo,4572,137
590,2024-02-11,Reddit,dress,I noticed many people wearing modern dress lately.,#fashiondaily #summerfashion,4024,218
591,2024-12-07,Reddit,dress,This blue dress is trending everywhere right now.,#minimalstyle #winterstyle #pastelfashion #kurtistyle #ethnicwear,3940,107
592,2025-11-07,Twitter,streetwear,I really love this modern pink streetwear. The wool material feels amazing.,#oversizedhoodie #styleblog #kurtistyle #outfitinspo #streetwear #winterstyle,1747,281
593,2025-06-23,Twitter,tshirt,This black tshirt is trending everywhere right now.,#ootd #trendalert,1927,49
594,2024-12-04,Reddit,dress,The striped design feels outdated to me.,#minimalstyle #fashiondaily #kurtistyle #trendalert #vintagefashion #summerfashion,3337,3
595,2024-06-08,Reddit,kurti,Seeing lots of blue kurti styles on social media recently.,#vintagefashion #summerfashion #pastelfashion,771,143
596,2025-08-29,Pinterest,handbag,The fabric of this handbag wrinkles too easily.,#styleblog #oversizedhoodie #kurtistyle #fashiondaily #outfitinspo #summerfashion,2963,60
597,2024-04-05,Instagram,tshirt,Totally obsessed with this slim fit tshirt. Perfect for everyday outfits.,#kurtistyle #streetwear #vintagefashion #ethnicwear,2903,157
598,2025-03-04,Pinterest,tshirt,The striped design feels outdated to me.,#pastelfashion #minimalstyle,2088,252
599,2025-06-20,Myntra,saree,Seeing lots of pink saree styles on social media recently.,#styleblog #summerfashion #trendalert #winterstyle #outfitinspo #vintagefashion,4939,114
600,2024-01-29,Reddit,dress,This green dress is trending everywhere right now.,#streetwear #outfitinspo,996,98
601,2024-08-21,Amazon,jacket,Seeing lots of pastel jacket styles on social media recently.,#styleblog #pastelfashion #winterstyle #kurtistyle #trendalert #fashiondaily,3003,22
602,2025-08-19,Reddit,streetwear,Fashion influencers are posting about vintage streetwear again.,#oversizedhoodie #summerfashion #outfitinspo #ethnicwear,4359,213
603,2025-04-27,Amazon,tshirt,The fabric of this tshirt wrinkles too easily.,#streetwear #vintagefashion #fashiondaily #summerfashion #pastelfashion,4320,224
604,2024-11-26,Reddit,tshirt,This dark tshirt looked better online than in real life.,#styleblog #pastelfashion #denimtrend,4286,266
605,2024-10-21,Myntra,jacket,The jacket looks good but the cotton quality feels cheap.,#denimtrend #fashiondaily #trendalert,913,167
606,2025-03-24,Reddit,dress,This embroidered dress seems to be trending this season.,#summerfashion #styleblog #fashiondaily,2240,92
607,2024-02-28,Pinterest,handbag,I expected better from this modern handbag. Not very comfortable.,#styleblog #vintagefashion #trendalert #pastelfashion,1076,135
608,2024-04-30,Amazon,handbag,Seeing lots of neon handbag styles on social media recently.,#ethnicwear #winterstyle,4575,20
609,2024-09-01,Myntra,tshirt,This plain tshirt looks stunning and the polyester quality is great.,#minimalstyle #oversizedhoodie #outfitinspo #ethnicwear #kurtistyle,2942,132
610,2025-03-23,Amazon,dress,This dark dress is trending everywhere right now.,#kurtistyle #oversizedhoodie,1390,276
611,2024-10-10,Twitter,handbag,The fabric of this handbag wrinkles too easily.,#pastelfashion #ethnicwear #minimalstyle #trendalert #ootd #oversizedhoodie,4412,230
612,2024-07-29,Instagram,hoodie,This printed hoodie seems to be trending this season.,#ethnicwear #pastelfashion #vintagefashion #trendalert #oversizedhoodie #denimtrend,664,175
613,2025-08-11,Reddit,kurti,This pastel kurti is trending everywhere right now.,#streetwear #oversizedhoodie #ootd,3493,219
614,2024-12-02,Instagram,tshirt,This floral tshirt looks stunning and the denim quality is great.,#oversizedhoodie #kurtistyle #trendalert #summerfashion #denimtrend #minimalstyle,4600,185
615,2025-05-06,Amazon,hoodie,Totally obsessed with this slim fit hoodie. Perfect for everyday outfits.,#ethnicwear #vintagefashion #denimtrend #kurtistyle,1140,15
616,2024-10-22,Twitter,kurti,Seeing lots of white kurti styles on social media recently.,#summerfashion #denimtrend #minimalstyle #fashiondaily #ootd #styleblog,697,120
617,2025-12-13,Pinterest,dress,Totally obsessed with this loose fit dress. Perfect for everyday outfits.,#minimalstyle #denimtrend #styleblog #vintagefashion #kurtistyle #summerfashion,194,6
618,2025-03-03,Instagram,kurti,This embroidered kurti looks stunning and the linen quality is great.,#ethnicwear #pastelfashion #summerfashion #ootd #trendalert,1339,178
619,2024-12-23,Myntra,handbag,Totally obsessed with this oversized handbag. Perfect for everyday outfits.,#kurtistyle #summerfashion #ethnicwear #fashiondaily #ootd,119,90
620,2024-11-10,Pinterest,kurti,The wool fabric makes this kurti super comfortable.,#oversizedhoodie #trendalert #summerfashion #pastelfashion #winterstyle,4974,103
621,2025-02-04,Amazon,kurti,This polyester kurti might become popular soon.,#streetwear #winterstyle #ootd #pastelfashion,4358,159
622,2024-06-27,Twitter,dress,Fashion influencers are posting about modern dress again.,#fashiondaily #ootd #styleblog,53,222
623,2024-11-13,Instagram,dress,The fabric of this dress wrinkles too easily.,#pastelfashion #trendalert #oversizedhoodie #ethnicwear,153,164
624,2025-05-23,Amazon,jacket,The jacket looks good but the denim quality feels cheap.,#outfitinspo #pastelfashion,4078,109
625,2025-01-23,Instagram,hoodie,This embroidered hoodie seems to be trending this season.,#pastelfashion #outfitinspo #ootd #streetwear #winterstyle,413,10
626,2024-04-19,Instagram,tshirt,This green tshirt is trending everywhere right now.,#ethnicwear #kurtistyle #ootd,2588,81
627,2024-11-13,Myntra,jacket,I expected better from this slim fit jacket. Not very comfortable.,#ootd #minimalstyle,2101,265
628,2025-09-18,Reddit,saree,Seeing lots of blue saree styles on social media recently.,#minimalstyle #summerfashion #denimtrend #fashiondaily #ootd,4901,69
629,2025-09-16,Myntra,hoodie,Seeing lots of pastel hoodie styles on social media recently.,#outfitinspo #denimtrend #ootd #ethnicwear,4959,35
630,2025-07-13,Twitter,dress,The wool fabric makes this dress super comfortable.,#streetwear #kurtistyle #pastelfashion,1080,88
631,2025-07-03,Twitter,kurti,The kurti looks good but the linen quality feels cheap.,#winterstyle #vintagefashion #pastelfashion #fashiondaily,3283,229
632,2025-09-09,Amazon,hoodie,I expected better from this modern hoodie. Not very comfortable.,#fashiondaily #outfitinspo #styleblog #ethnicwear #kurtistyle,4015,233
633,2025-08-25,Myntra,streetwear,I really love this slim fit dark streetwear. The polyester material feels amazing.,#trendalert #summerfashion,4660,63
634,2025-03-24,Myntra,handbag,I really love this oversized pastel handbag. The linen material feels amazing.,#vintagefashion #fashiondaily #ootd #summerfashion #streetwear #denimtrend,4601,96
635,2025-01-27,Myntra,kurti,I expected better from this minimal kurti. Not very comfortable.,#winterstyle #ootd #denimtrend,3021,161
636,2025-08-09,Instagram,streetwear,Fashion influencers are posting about loose fit streetwear again.,#pastelfashion #oversizedhoodie #minimalstyle #ootd,1008,137
637,2024-03-09,Reddit,hoodie,The fabric of this hoodie wrinkles too easily.,#minimalstyle #ootd #ethnicwear,3483,153
638,2025-08-15,Reddit,dress,Fashion influencers are posting about loose fit dress again.,#ootd #styleblog,3795,139
639,2024-10-28,Reddit,dress,I expected better from this vintage dress. Not very comfortable.,#minimalstyle #kurtistyle #styleblog #pastelfashion #ootd,3262,6
640,2024-04-08,Pinterest,streetwear,The wool fabric makes this streetwear super comfortable.,#summerfashion #winterstyle #fashiondaily,606,67
641,2025-05-14,Instagram,saree,I noticed many people wearing slim fit saree lately.,#denimtrend #streetwear #outfitinspo,732,293
642,2024-01-30,Amazon,tshirt,I expected better from this minimal tshirt. Not very comfortable.,#denimtrend #summerfashion #oversizedhoodie #ethnicwear #outfitinspo #minimalstyle,2875,172
643,2025-12-28,Instagram,handbag,The linen fabric makes this handbag super comfortable.,#outfitinspo #summerfashion #winterstyle #ethnicwear #pastelfashion #streetwear,1590,185
644,2024-03-31,Myntra,kurti,I expected better from this slim fit kurti. Not very comfortable.,#winterstyle #vintagefashion #oversizedhoodie #trendalert,157,16
645,2024-03-09,Instagram,kurti,This striped kurti looks stunning and the cotton quality is great.,#ethnicwear #streetwear #denimtrend #trendalert #fashiondaily,879,274
646,2024-03-08,Myntra,tshirt,The linen fabric makes this tshirt super comfortable.,#summerfashion #outfitinspo #pastelfashion #ethnicwear #ootd #denimtrend,3600,155
647,2024-08-10,Instagram,tshirt,I noticed many people wearing vintage tshirt lately.,#winterstyle #denimtrend #styleblog #summerfashion #fashiondaily #kurtistyle,4494,22
648,2025-12-20,Pinterest,tshirt,The printed design feels outdated to me.,#outfitinspo #trendalert #vintagefashion #kurtistyle #oversizedhoodie #denimtrend,3252,62
649,2024-09-07,Instagram,jacket,The striped design feels outdated to me.,#vintagefashion #minimalstyle,1616,84
650,2024-11-15,Myntra,tshirt,This green tshirt is trending everywhere right now.,#fashiondaily #vintagefashion #minimalstyle #outfitinspo,903,102
651,2024-10-13,Reddit,tshirt,This dark tshirt looked better online than in real life.,#fashiondaily #vintagefashion #outfitinspo,263,61
652,2024-05-18,Pinterest,hoodie,This printed hoodie looks stunning and the denim quality is great.,#kurtistyle #oversizedhoodie,3767,295
653,2025-03-20,Myntra,hoodie,This floral hoodie seems to be trending this season.,#outfitinspo #kurtistyle #minimalstyle #trendalert #styleblog,1118,59
654,2024-02-25,Myntra,dress,Fashion influencers are posting about minimal dress again.,#outfitinspo #fashiondaily #styleblog #minimalstyle #denimtrend,296,80
655,2024-05-01,Twitter,saree,The silk fabric makes this saree super comfortable.,#styleblog #fashiondaily #winterstyle,1419,289
656,2024-10-23,Pinterest,dress,I noticed many people wearing modern dress lately.,#minimalstyle #oversizedhoodie #fashiondaily,4320,109
657,2024-12-22,Twitter,saree,The embroidered design feels outdated to me.,#streetwear #fashiondaily #denimtrend,3258,160
658,2025-09-20,Twitter,handbag,The handbag looks good but the silk quality feels cheap.,#fashiondaily #vintagefashion #summerfashion,3686,109
659,2025-04-18,Instagram,hoodie,This striped hoodie looks stunning and the silk quality is great.,#ootd #vintagefashion,98,185
660,2024-09-21,Instagram,kurti,This dark kurti is trending everywhere right now.,#ootd #streetwear #denimtrend #oversizedhoodie #kurtistyle,2502,36
661,2024-03-02,Myntra,streetwear,Totally obsessed with this minimal streetwear. Perfect for everyday outfits.,#vintagefashion #ethnicwear,480,262
662,2024-12-23,Amazon,hoodie,I noticed many people wearing oversized hoodie lately.,#pastelfashion #winterstyle #styleblog #oversizedhoodie #fashiondaily,4592,213
663,2024-09-04,Instagram,dress,Totally obsessed with this oversized dress. Perfect for everyday outfits.,#ethnicwear #winterstyle #minimalstyle #outfitinspo #denimtrend,1935,251
664,2025-05-05,Amazon,kurti,This silk kurti might become popular soon.,#winterstyle #pastelfashion #outfitinspo #minimalstyle #denimtrend #kurtistyle,3914,133
665,2025-03-17,Myntra,saree,This linen saree might become popular soon.,#pastelfashion #vintagefashion #styleblog #outfitinspo,3519,19
666,2025-01-18,Reddit,saree,The striped design feels outdated to me.,#kurtistyle #summerfashion #denimtrend #streetwear #oversizedhoodie,4886,162
667,2025-07-05,Myntra,kurti,This dark kurti is trending everywhere right now.,#styleblog #ootd,3376,147
668,2025-01-22,Twitter,saree,Totally obsessed with this slim fit saree. Perfect for everyday outfits.,#fashiondaily #minimalstyle #pastelfashion #streetwear,3044,11
669,2025-04-24,Myntra,jacket,This printed jacket looks stunning and the silk quality is great.,#fashiondaily #minimalstyle #winterstyle,563,213
670,2024-06-03,Instagram,dress,I expected better from this minimal dress. Not very comfortable.,#winterstyle #minimalstyle #fashiondaily #styleblog,973,22
671,2025-05-17,Amazon,dress,Totally obsessed with this loose fit dress. Perfect for everyday outfits.,#ootd #vintagefashion,1492,54
672,2025-07-06,Pinterest,jacket,This white jacket looked better online than in real life.,#kurtistyle #streetwear #winterstyle #fashiondaily #trendalert,4038,36
673,2024-08-25,Myntra,saree,Fashion influencers are posting about oversized saree again.,#pastelfashion #oversizedhoodie #styleblog,2573,135
674,2024-05-31,Myntra,jacket,This floral jacket seems to be trending this season.,#oversizedhoodie #ethnicwear #denimtrend,1204,109
675,2025-08-16,Amazon,kurti,The wool fabric makes this kurti super comfortable.,#oversizedhoodie #streetwear,4474,133
676,2025-01-30,Reddit,saree,The fabric of this saree wrinkles too easily.,#winterstyle #kurtistyle,4522,239
677,2025-12-03,Myntra,handbag,Totally obsessed with this modern handbag. Perfect for everyday outfits.,#trendalert #styleblog #pastelfashion #minimalstyle,741,222
678,2024-05-06,Myntra,saree,Totally obsessed with this vintage saree. Perfect for everyday outfits.,#styleblog #winterstyle #denimtrend #trendalert #outfitinspo #oversizedhoodie,876,256
679,2024-07-13,Pinterest,hoodie,I noticed many people wearing minimal hoodie lately.,#styleblog #streetwear #denimtrend #outfitinspo,3257,9
680,2025-10-03,Amazon,jacket,The linen fabric makes this jacket super comfortable.,#streetwear #trendalert #summerfashion #denimtrend,4033,62
681,2025-06-12,Instagram,jacket,Totally obsessed with this slim fit jacket. Perfect for everyday outfits.,#ootd #denimtrend #vintagefashion,1928,265
682,2024-10-27,Myntra,tshirt,Totally obsessed with this vintage tshirt. Perfect for everyday outfits.,#trendalert #denimtrend,2731,240
683,2024-07-20,Instagram,jacket,This striped jacket looks stunning and the denim quality is great.,#outfitinspo #oversizedhoodie #trendalert #pastelfashion #fashiondaily #denimtrend,3538,128
684,2025-12-17,Reddit,tshirt,This pink tshirt is trending everywhere right now.,#summerfashion #winterstyle,751,44
685,2025-01-12,Amazon,dress,I noticed many people wearing oversized dress lately.,#fashiondaily #denimtrend #outfitinspo #streetwear,4055,77
686,2024-01-26,Pinterest,jacket,The jacket looks good but the wool quality feels cheap.,#summerfashion #ethnicwear #ootd,3343,174
687,2025-07-05,Amazon,handbag,I really love this modern neon handbag. The linen material feels amazing.,#vintagefashion #streetwear #winterstyle #ethnicwear,3417,227
688,2025-06-20,Reddit,streetwear,This black streetwear looked better online than in real life.,#trendalert #fashiondaily #vintagefashion #kurtistyle #minimalstyle #ootd,3258,195
689,2025-06-09,Reddit,hoodie,Seeing lots of beige hoodie styles on social media recently.,#pastelfashion #outfitinspo,2900,32
690,2024-12-29,Pinterest,kurti,I noticed many people wearing modern kurti lately.,#kurtistyle #denimtrend #styleblog #trendalert #oversizedhoodie,4340,165
691,2025-02-16,Amazon,kurti,The silk fabric makes this kurti super comfortable.,#summerfashion #oversizedhoodie #styleblog #minimalstyle #fashiondaily #streetwear,315,186
692,2025-04-24,Reddit,hoodie,I expected better from this oversized hoodie. Not very comfortable.,#outfitinspo #vintagefashion #summerfashion #trendalert,4561,216
693,2024-06-15,Amazon,kurti,This embroidered kurti looks stunning and the cotton quality is great.,#pastelfashion #outfitinspo #oversizedhoodie,3500,79
694,2024-05-13,Pinterest,streetwear,The embroidered design feels outdated to me.,#ootd #styleblog #summerfashion #vintagefashion #trendalert #kurtistyle,3087,130
695,2024-06-25,Twitter,streetwear,This pink streetwear is trending everywhere right now.,#ootd #summerfashion #ethnicwear #minimalstyle #winterstyle #streetwear,471,230
696,2025-10-10,Reddit,saree,Seeing lots of black saree styles on social media recently.,#minimalstyle #streetwear #oversizedhoodie #kurtistyle,4951,103
697,2024-06-12,Pinterest,dress,Fashion influencers are posting about modern dress again.,#winterstyle #vintagefashion #ootd #fashiondaily,4855,67
698,2025-10-23,Pinterest,jacket,This white jacket looked better online than in real life.,#ethnicwear #vintagefashion #denimtrend #winterstyle,3261,277
699,2025-12-13,Twitter,kurti,Fashion influencers are posting about minimal kurti again.,#fashiondaily #outfitinspo #minimalstyle #winterstyle,1577,174
700,2024-08-06,Instagram,kurti,The fabric of this kurti wrinkles too easily.,#pastelfashion #summerfashion,1210,82
701,2025-01-18,Instagram,handbag,The embroidered design feels outdated to me.,#minimalstyle #vintagefashion #streetwear #outfitinspo #trendalert #oversizedhoodie,2283,146
702,2025-03-07,Pinterest,jacket,Fashion influencers are posting about slim fit jacket again.,#styleblog #trendalert #ootd #summerfashion,2611,222
