id,date,platform,category,text,hashtags,likes,replies
1050,2025-08-27,Myntra,saree,This plain saree looks stunning and the linen quality is great.,#fashiondaily #oversizedhoodie #pastelfashion,1049,215
1051,2024-03-23,Reddit,jacket,Seeing lots of dark jacket styles on social media recently.,#summerfashion #vintagefashion #kurtistyle #streetwear #minimalstyle #pastelfashion,603,255
1052,2025-01-13,Instagram,jacket,This plain jacket looks stunning and the silk quality is great.,#oversizedhoodie #outfitinspo #kurtistyle #ootd,1784,147
1053,2025-09-08,Instagram,streetwear,I noticed many people wearing modern streetwear lately.,#kurtistyle #winterstyle #ethnicwear,4236,285
1054,2024-12-30,Pinterest,jacket,Totally obsessed with this vintage jacket. Perfect for everyday outfits.,#winterstyle #vintagefashion #streetwear,3393,233
1055,2025-11-22,Amazon,dress,Fashion influencers are posting about vintage dress again.,#ootd #vintagefashion #outfitinspo #streetwear,2123,241
1056,2024-08-01,Instagram,streetwear,I expected better from this oversized streetwear. Not very comfortable.,#kurtistyle #vintagefashion,3586,260
1057,2025-07-01,Amazon,handbag,This white handbag is trending everywhere right now.,#oversizedhoodie #ootd #fashiondaily #winterstyle,2814,272
1058,2024-01-14,Instagram,hoodie,This pastel hoodie is trending everywhere right now.,#kurtistyle #fashiondaily #oversizedhoodie #ootd,4266,123
1059,2025-12-30,Amazon,tshirt,This striped tshirt looks stunning and the linen quality is great.,#denimtrend #outfitinspo #pastelfashion,2853,20
1060,2025-03-24,Reddit,tshirt,I expected better from this slim fit tshirt. Not very comfortable.,#fashiondaily #kurtistyle,1895,46
1061,2024-04-26,Amazon,jacket,Totally obsessed with this vintage jacket. Perfect for everyday outfits.,#streetwear #summerfashion #outfitinspo,3739,237
1062,2024-07-18,Pinterest,tshirt,Seeing lots of green tshirt styles on social media recently.,#fashiondaily #trendalert #streetwear #ootd #kurtistyle,1875,132
1063,2024-03-03,Myntra,streetwear,The fabric of this streetwear wrinkles too easily.,#outfitinspo #trendalert,1993,228
1064,2024-02-23,Amazon,streetwear,The fabric of this streetwear wrinkles too easily.,#streetwear #ootd #pastelfashion,2750,237
1065,2025-04-09,Twitter,hoodie,This pink hoodie looked better online than in real life.,#styleblog #winterstyle #ootd #denimtrend #trendalert,2521,235
1066,2024-10-05,Twitter,hoodie,Totally obsessed with this oversized hoodie. Perfect for everyday outfits.,#minimalstyle #vintagefashion #winterstyle #pastelfashion,179,297
1067,2025-08-01,Amazon,saree,Seeing lots of white saree styles on social media recently.,#streetwear #winterstyle #outfitinspo,4374,299
1068,2025-11-18,Instagram,jacket,I noticed many people wearing loose fit jacket lately.,#ethnicwear #denimtrend #pastelfashion #styleblog #summerfashion #trendalert,1287,246
1069,2024-06-19,Reddit,jacket,This printed jacket seems to be trending this season.,#outfitinspo #summerfashion #styleblog #vintagefashion #winterstyle,2690,246
1070,2025-10-05,Twitter,jacket,I really love this slim fit black jacket. The cotton material feels amazing.,#streetwear #vintagefashion,4365,116
1071,2025-11-01,Pinterest,handbag,Seeing lots of white handbag styles on social media recently.,#styleblog #minimalstyle #ootd #fashiondaily #kurtistyle #trendalert,889,43
1072,2024-07-14,Reddit,dress,This pink dress looked better online than in real life.,#minimalstyle #pastelfashion #denimtrend,4093,54
1073,2024-08-27,Myntra,jacket,I expected better from this vintage jacket. Not very comfortable.,#trendalert #ethnicwear #vintagefashion,557,81
1074,2024-10-15,Reddit,kurti,Fashion influencers are posting about slim fit kurti again.,#streetwear #vintagefashion #winterstyle #fashiondaily,2938,212
1075,2024-01-30,Twitter,hoodie,Totally obsessed with this modern hoodie. Perfect for everyday outfits.,#vintagefashion #styleblog #fashiondaily #ootd,4702,182
1076,2025-10-19,Reddit,saree,This plain saree looks stunning and the wool quality is great.,#winterstyle #kurtistyle #summerfashion #denimtrend,2784,264
1077,2024-01-16,Pinterest,dress,I really love this modern green dress. The wool material feels amazing.,#styleblog #fashiondaily,1946,29
1078,2025-03-27,Myntra,streetwear,This striped streetwear looks stunning and the denim quality is great.,#denimtrend #pastelfashion #winterstyle,595,262
1079,2025-09-24,Amazon,streetwear,This white streetwear is trending everywhere right now.,#styleblog #kurtistyle,1967,68
1080,2024-09-19,Instagram,streetwear,The streetwear looks good but the linen quality feels cheap.,#vintagefashion #ootd #styleblog #minimalstyle #outfitinspo #trendalert,2722,246
1081,2024-09-02,Amazon,jacket,Seeing lots of neon jacket styles on social media recently.,#ootd #summerfashion #denimtrend #styleblog,3595,67
1082,2025-06-08,Myntra,streetwear,This embroidered streetwear looks stunning and the linen quality is great.,#summerfashion #denimtrend,2842,140
1083,2024-05-12,Twitter,hoodie,I really love this modern black hoodie. The linen material feels amazing.,#streetwear #oversizedhoodie,3400,154
1084,2024-11-04,Amazon,dress,The fabric of this dress wrinkles too easily.,#summerfashion #streetwear #vintagefashion #minimalstyle,3536,113
1085,2024-10-02,Instagram,streetwear,The streetwear looks good but the wool quality feels cheap.,#vintagefashion #denimtrend,122,34
1086,2025-03-16,Twitter,dress,I noticed many people wearing oversized dress lately.,#denimtrend #summerfashion,4796,201
1087,2024-12-01,Instagram,jacket,The printed design feels outdated to me.,#outfitinspo #streetwear #pastelfashion #summerfashion #minimalstyle #styleblog,1607,250
1088,2024-10-27,Instagram,hoodie,Fashion influencers are posting about loose fit hoodie again.,#summerfashion #oversizedhoodie #denimtrend #kurtistyle,261,272
1089,2024-04-08,Reddit,handbag,I really love this minimal pastel handbag. The polyester material feels amazing.,#styleblog #ootd #minimalstyle,1881,143
1090,2024-03-05,Twitter,hoodie,I noticed many people wearing modern hoodie lately.,#streetwear #minimalstyle #kurtistyle,2264,153
1091,2025-06-11,Myntra,tshirt,This pastel tshirt is trending everywhere right now.,#oversizedhoodie #minimalstyle #denimtrend #streetwear #outfitinspo #pastelfashion,1989,31
1092,2025-11-28,Twitter,hoodie,This striped hoodie looks stunning and the polyester quality is great.,#winterstyle #vintagefashion,249,109
1093,2024-01-17,Twitter,hoodie,Totally obsessed with this loose fit hoodie. Perfect for everyday outfits.,#oversizedhoodie #trendalert #pastelfashion #winterstyle #vintagefashion,4871,170
1094,2025-08-23,Myntra,jacket,The linen fabric makes this jacket super comfortable.,#fashiondaily #summerfashion,2979,250
1095,2024-08-15,Instagram,hoodie,This plain hoodie seems to be trending this season.,#outfitinspo #pastelfashion,2940,265
1096,2024-02-04,Instagram,jacket,The fabric of this jacket wrinkles too easily.,#trendalert #pastelfashion #oversizedhoodie #styleblog,2235,26
1097,2025-01-16,Pinterest,kurti,This floral kurti looks stunning and the denim quality is great.,#winterstyle #kurtistyle #streetwear #summerfashion #outfitinspo #denimtrend,3661,247
1098,2024-01-21,Instagram,kurti,Seeing lots of blue kurti styles on social media recently.,#kurtistyle #pastelfashion #trendalert #oversizedhoodie,2744,19
1099,2025-07-23,Reddit,handbag,The embroidered design feels outdated to me.,#fashiondaily #denimtrend #ootd #trendalert,1611,163
1100,2024-04-20,Reddit,streetwear,The streetwear looks good but the silk quality feels cheap.,#outfitinspo #ootd #winterstyle #oversizedhoodie #pastelfashion #streetwear,2449,259
1101,2024-05-22,Reddit,saree,This beige saree is trending everywhere right now.,#ethnicwear #winterstyle,305,88
1102,2025-08-31,Amazon,handbag,I noticed many people wearing minimal handbag lately.,#minimalstyle #streetwear,3682,195
1103,2024-06-23,Myntra,saree,This green saree is trending everywhere right now.,#denimtrend #winterstyle #streetwear,4958,258
1104,2025-01-12,Amazon,dress,This striped dress looks stunning and the polyester quality is great.,#oversizedhoodie #streetwear #ethnicwear #summerfashion #ootd,1302,137
1105,2024-05-29,Twitter,tshirt,This denim tshirt might become popular soon.,#streetwear #ootd #ethnicwear,3812,110
1106,2025-02-10,Reddit,dress,Seeing lots of dark dress styles on social media recently.,#summerfashion #trendalert,422,154
1107,2025-01-30,Pinterest,jacket,The fabric of this jacket wrinkles too easily.,#ethnicwear #trendalert #streetwear #styleblog,4891,80
1108,2025-12-16,Pinterest,tshirt,The tshirt looks good but the denim quality feels cheap.,#pastelfashion #outfitinspo,3514,109
1109,2025-07-26,Instagram,handbag,The plain design feels outdated to me.,#minimalstyle #ethnicwear,2696,18
1110,2024-06-22,Instagram,streetwear,This black streetwear is trending everywhere right now.,#kurtistyle #trendalert #styleblog #ootd #oversizedhoodie,12,280
1111,2025-10-08,Instagram,hoodie,This cotton hoodie might become popular soon.,#kurtistyle #ootd,142,219
1112,2024-03-24,Myntra,handbag,This black handbag looked better online than in real life.,#pastelfashion #outfitinspo #kurtistyle,2566,33
1113,2025-07-09,Reddit,saree,Fashion influencers are posting about slim fit saree again.,#trendalert #denimtrend #kurtistyle #fashiondaily #streetwear #outfitinspo,3972,170
1114,2025-09-24,Pinterest,hoodie,I really love this minimal neon hoodie. The cotton material feels amazing.,#trendalert #streetwear #outfitinspo #vintagefashion #ethnicwear #winterstyle,3256,40
1115,2025-08-17,Pinterest,streetwear,The fabric of this streetwear wrinkles too easily.,#pastelfashion #trendalert #ethnicwear #ootd #summerfashion,3380,252
1116,2025-03-25,Pinterest,hoodie,This printed hoodie looks stunning and the cotton quality is great.,#streetwear #vintagefashion #outfitinspo #kurtistyle #ootd #oversizedhoodie,4286,126
1117,2024-08-30,Amazon,streetwear,The streetwear looks good but the wool quality feels cheap.,#styleblog #winterstyle #summerfashion #ethnicwear #kurtistyle,4602,294
1118,2024-11-30,Twitter,hoodie,Seeing lots of green hoodie styles on social media recently.,#denimtrend #kurtistyle #outfitinspo #trendalert #summerfashion,3113,49
1119,2024-01-26,Instagram,kurti,Totally obsessed with this minimal kurti. Perfect for everyday outfits.,#kurtistyle #pastelfashion #winterstyle #trendalert #ethnicwear #streetwear,1528,75
1120,2025-01-28,Amazon,jacket,This white jacket looked better online than in real life.,#fashiondaily #vintagefashion,1484,210
1121,2024-05-19,Pinterest,streetwear,This polyester streetwear might become popular soon.,#minimalstyle #pastelfashion,2101,176
1122,2025-04-08,Reddit,hoodie,This neon hoodie is trending everywhere right now.,#oversizedhoodie #winterstyle #pastelfashion,3566,145
1123,2025-12-27,Amazon,hoodie,The cotton fabric makes this hoodie super comfortable.,#styleblog #fashiondaily #winterstyle #streetwear #ethnicwear,4203,296
1124,2024-10-27,Pinterest,jacket,I really love this loose fit blue jacket. The linen material feels amazing.,#fashiondaily #streetwear #ootd #pastelfashion,1442,295
1125,2024-07-20,Instagram,hoodie,The denim fabric makes this hoodie super comfortable.,#kurtistyle #ethnicwear #winterstyle #pastelfashion,340,216
1126,2024-08-23,Instagram,kurti,The silk fabric makes this kurti super comfortable.,#trendalert #minimalstyle #styleblog,3006,198
1127,2025-11-30,Twitter,jacket,The polyester fabric makes this jacket super comfortable.,#kurtistyle #trendalert,2453,272
1128,2025-02-26,Instagram,dress,I really love this slim fit green dress. The silk material feels amazing.,#trendalert #outfitinspo #kurtistyle #denimtrend #ootd,2105,92
1129,2024-12-13,Reddit,kurti,I really love this vintage black kurti. The denim material feels amazing.,#trendalert #oversizedhoodie #outfitinspo #summerfashion,1463,147
1130,2024-10-27,Pinterest,dress,The fabric of this dress wrinkles too easily.,#pastelfashion #kurtistyle #styleblog,4313,197
1131,2025-04-28,Reddit,jacket,The fabric of this jacket wrinkles too easily.,#vintagefashion #oversizedhoodie #streetwear #ootd #ethnicwear #pastelfashion,282,256
1132,2025-03-15,Amazon,streetwear,I really love this vintage neon streetwear. The cotton material feels amazing.,#summerfashion #fashiondaily #kurtistyle #vintagefashion #trendalert #styleblog,333,61
1133,2024-04-30,Myntra,streetwear,Seeing lots of blue streetwear styles on social media recently.,#pastelfashion #winterstyle #summerfashion #denimtrend #kurtistyle,513,287
1134,2024-12-30,Amazon,saree,This beige saree looked better online than in real life.,#trendalert #outfitinspo #ethnicwear #pastelfashion #styleblog #vintagefashion,176,125
1135,2024-07-04,Amazon,jacket,I really love this loose fit pastel jacket. The cotton material feels amazing.,#minimalstyle #oversizedhoodie #fashiondaily #kurtistyle #styleblog #vintagefashion,176,284
1136,2025-01-23,Instagram,handbag,This pink handbag is trending everywhere right now.,#pastelfashion #vintagefashion #outfitinspo #kurtistyle #fashiondaily #ootd,1066,229
1137,2024-07-30,Twitter,kurti,This embroidered kurti looks stunning and the polyester quality is great.,#ethnicwear #kurtistyle #summerfashion #minimalstyle #styleblog,3445,32
1138,2025-03-09,Pinterest,saree,Fashion influencers are posting about modern saree again.,#ootd #winterstyle #styleblog #oversizedhoodie #denimtrend #ethnicwear,415,125
1139,2025-08-27,Amazon,jacket,The fabric of this jacket wrinkles too easily.,#fashiondaily #ootd #minimalstyle #winterstyle,572,81
1140,2025-07-31,Reddit,handbag,The handbag looks good but the silk quality feels cheap.,#minimalstyle #ootd #ethnicwear #denimtrend #vintagefashion #streetwear,1791,15
1141,2025-12-28,Pinterest,streetwear,I noticed many people wearing loose fit streetwear lately.,#summerfashion #winterstyle #styleblog,4309,87
1142,2025-08-18,Instagram,jacket,I expected better from this vintage jacket. Not very comfortable.,#ootd #summerfashion,830,185
1143,2025-08-31,Reddit,handbag,Fashion influencers are posting about slim fit handbag again.,#fashiondaily #ethnicwear #vintagefashion #streetwear #minimalstyle,1562,200
1144,2025-03-22,Instagram,jacket,I expected better from this modern jacket. Not very comfortable.,#styleblog #winterstyle #ootd #summerfashion,1112,29
1145,2024-03-08,Myntra,jacket,I noticed many people wearing loose fit jacket lately.,#ethnicwear #streetwear #vintagefashion #ootd #trendalert,482,203
1146,2024-07-03,Pinterest,streetwear,Totally obsessed with this vintage streetwear. Perfect for everyday outfits.,#ethnicwear #vintagefashion #ootd,3118,203
1147,2024-03-20,Pinterest,jacket,This pink jacket is trending everywhere right now.,#streetwear #ootd,1297,193
1148,2024-10-05,Pinterest,tshirt,This pink tshirt is trending everywhere right now.,#kurtistyle #outfitinspo #minimalstyle,1506,213
1149,2024-05-07,Myntra,kurti,The cotton fabric makes this kurti super comfortable.,#streetwear #ootd #styleblog #oversizedhoodie #vintagefashion #minimalstyle,2910,203
1150,2024-06-18,Pinterest,streetwear,Totally obsessed with this modern streetwear. Perfect for everyday outfits.,#minimalstyle #trendalert #winterstyle #vintagefashion,233,186
1151,2025-12-05,Reddit,jacket,Fashion influencers are posting about minimal jacket again.,#summerfashion #winterstyle #oversizedhoodie #fashiondaily,4150,213
1152,2025-07-13,Twitter,jacket,Fashion influencers are posting about oversized jacket again.,#kurtistyle #fashiondaily,1214,74
1153,2025-03-25,Pinterest,tshirt,I really love this minimal neon tshirt. The cotton material feels amazing.,#streetwear #oversizedhoodie #ethnicwear #vintagefashion #minimalstyle #ootd,840,263
1154,2024-10-02,Pinterest,streetwear,Seeing lots of white streetwear styles on social media recently.,#oversizedhoodie #streetwear #outfitinspo #vintagefashion #minimalstyle #ethnicwear,679,93
1155,2025-04-08,Amazon,jacket,This striped jacket seems to be trending this season.,#outfitinspo #denimtrend,2697,227
1156,2025-06-17,Instagram,jacket,The embroidered design feels outdated to me.,#outfitinspo #denimtrend #ootd #pastelfashion #oversizedhoodie #ethnicwear,2787,261
1157,2025-08-23,Reddit,kurti,This plain kurti seems to be trending this season.,#denimtrend #oversizedhoodie #trendalert,3381,88
1158,2024-09-12,Amazon,saree,This wool saree might become popular soon.,#trendalert #oversizedhoodie #summerfashion #styleblog #streetwear #fashiondaily,1957,80
1159,2025-01-20,Amazon,kurti,This plain kurti seems to be trending this season.,#minimalstyle #vintagefashion #ootd #denimtrend,3411,105
1160,2025-02-23,Reddit,handbag,The handbag looks good but the linen quality feels cheap.,#vintagefashion #styleblog #ethnicwear #outfitinspo #minimalstyle #streetwear,1974,128
1161,2024-06-22,Pinterest,streetwear,The streetwear looks good but the silk quality feels cheap.,#pastelfashion #ootd #minimalstyle #streetwear #oversizedhoodie #outfitinspo,2851,278
1162,2025-05-10,Instagram,jacket,I expected better from this vintage jacket. Not very comfortable.,#ootd #trendalert #minimalstyle #kurtistyle #denimtrend,1026,35
1163,2024-12-26,Reddit,saree,I really love this loose fit neon saree. The wool material feels amazing.,#kurtistyle #outfitinspo #streetwear #minimalstyle,609,71
1164,2024-02-25,Twitter,saree,This plain saree looks stunning and the cotton quality is great.,#winterstyle #kurtistyle #pastelfashion,1456,22
1165,2024-01-13,Pinterest,tshirt,The embroidered design feels outdated to me.,#trendalert #vintagefashion #ethnicwear #ootd #oversizedhoodie,4410,36
1166,2025-10-24,Instagram,tshirt,I expected better from this vintage tshirt. Not very comfortable.,#kurtistyle #denimtrend #oversizedhoodie,3316,170
1167,2024-05-09,Twitter,jacket,I expected better from this vintage jacket. Not very comfortable.,#winterstyle #vintagefashion #ethnicwear #styleblog #trendalert,3471,26
1168,2024-10-30,Reddit,kurti,I really love this modern blue kurti. The cotton material feels amazing.,#outfitinspo #ootd #summerfashion #denimtrend #minimalstyle,3023,26
1169,2024-05-01,Myntra,kurti,This beige kurti looked better online than in real life.,#pastelfashion #minimalstyle #fashiondaily #streetwear,47,220
1170,2025-03-18,Twitter,jacket,I expected better from this vintage jacket. Not very comfortable.,#ootd #vintagefashion,3287,267
1171,2024-10-12,Twitter,saree,The fabric of this saree wrinkles too easily.,#minimalstyle #streetwear,797,245
1172,2024-03-30,Reddit,streetwear,The printed design feels outdated to me.,#winterstyle #ethnicwear #outfitinspo #denimtrend #trendalert #oversizedhoodie,3183,114
1173,2025-06-17,Amazon,kurti,This wool kurti might become popular soon.,#pastelfashion #fashiondaily #trendalert,4103,200
1174,2024-07-05,Amazon,tshirt,This wool tshirt might become popular soon.,#minimalstyle #oversizedhoodie #fashiondaily #denimtrend #outfitinspo,2449,16
1175,2024-12-18,Reddit,dress,Totally obsessed with this oversized dress. Perfect for everyday outfits.,#vintagefashion #kurtistyle #minimalstyle #ethnicwear,4580,22
1176,2025-08-26,Pinterest,handbag,This plain handbag seems to be trending this season.,#denimtrend #summerfashion #styleblog #minimalstyle #streetwear #pastelfashion,1962,145
1177,2025-08-06,Pinterest,dress,The fabric of this dress wrinkles too easily.,#summerfashion #denimtrend #styleblog #streetwear #oversizedhoodie,4732,34
1178,2024-07-20,Twitter,tshirt,Totally obsessed with this slim fit tshirt. Perfect for everyday outfits.,#vintagefashion #oversizedhoodie #styleblog #winterstyle,3923,151
1179,2025-03-13,Twitter,kurti,The fabric of this kurti wrinkles too easily.,#pastelfashion #denimtrend #ethnicwear #fashiondaily #streetwear,2537,269
1180,2024-01-17,Amazon,streetwear,The linen fabric makes this streetwear super comfortable.,#trendalert #kurtistyle #denimtrend #winterstyle #minimalstyle #vintagefashion,2648,296
1181,2025-04-29,Myntra,saree,I expected better from this oversized saree. Not very comfortable.,#pastelfashion #ethnicwear #denimtrend #minimalstyle,3890,90
1182,2024-10-30,Twitter,jacket,I noticed many people wearing loose fit jacket lately.,#minimalstyle #denimtrend #pastelfashion #ethnicwear,824,152
1183,2024-12-25,Instagram,handbag,Seeing lots of beige handbag styles on social media recently.,#streetwear #denimtrend,3215,292
1184,2024-12-11,Instagram,hoodie,I noticed many people wearing modern hoodie lately.,#denimtrend #oversizedhoodie,993,71
1185,2024-05-06,Twitter,jacket,The floral design feels outdated to me.,#oversizedhoodie #minimalstyle,1647,124
1186,2025-10-01,Myntra,saree,This pastel saree is trending everywhere right now.,#styleblog #minimalstyle #winterstyle #summerfashion,1412,252
1187,2024-03-27,Twitter,jacket,This floral jacket seems to be trending this season.,#oversizedhoodie #denimtrend #ethnicwear #vintagefashion,2292,130
1188,2025-03-14,Myntra,saree,Seeing lots of white saree styles on social media recently.,#ethnicwear #ootd #vintagefashion #streetwear #denimtrend,4757,66
1189,2024-07-19,Instagram,dress,Fashion influencers are posting about modern dress again.,#oversizedhoodie #streetwear #ethnicwear #kurtistyle,939,188
1190,2025-09-25,Pinterest,tshirt,This green tshirt is trending everywhere right now.,#styleblog #trendalert #summerfashion #pastelfashion,3457,170
1191,2024-10-23,Myntra,kurti,Totally obsessed with this slim fit kurti. Perfect for everyday outfits.,#outfitinspo #styleblog #kurtistyle #vintagefashion #pastelfashion,591,144
1192,2025-05-02,Twitter,streetwear,I noticed many people wearing modern streetwear lately.,#streetwear #minimalstyle #winterstyle #styleblog #oversizedhoodie #fashiondaily,1529,164
1193,2025-12-31,Twitter,jacket,Fashion influencers are posting about oversized jacket again.,#kurtistyle #ethnicwear #summerfashion #ootd #denimtrend,739,213
1194,2025-01-20,Pinterest,dress,This blue dress looked better online than in real life.,#minimalstyle #winterstyle #ethnicwear #kurtistyle #outfitinspo #trendalert,2076,6
1195,2025-01-02,Pinterest,streetwear,Totally obsessed with this oversized streetwear. Perfect for everyday outfits.,#ootd #outfitinspo #winterstyle,2711,214
1196,2025-01-17,Reddit,dress,The silk fabric makes this dress super comfortable.,#pastelfashion #ethnicwear #ootd #vintagefashion,3202,245
1197,2025-07-22,Instagram,saree,This cotton saree might become popular soon.,#summerfashion #trendalert #ootd #outfitinspo #ethnicwear,4872,233
1198,2025-04-06,Instagram,handbag,I really love this loose fit blue handbag. The silk material feels amazing.,#ethnicwear #pastelfashion,2268,299
1199,2024-01-24,Pinterest,jacket,This printed jacket seems to be trending this season.,#vintagefashion #minimalstyle #ethnicwear #oversizedhoodie,2534,112
1200,2025-11-08,Twitter,dress,This cotton dress might become popular soon.,#summerfashion #ootd #styleblog,4723,47
1201,2025-05-08,Reddit,saree,I noticed many people wearing modern saree lately.,#oversizedhoodie #kurtistyle #denimtrend #outfitinspo,3438,269
1202,2024-05-29,Reddit,saree,I expected better from this loose fit saree. Not very comfortable.,#minimalstyle #styleblog #streetwear #kurtistyle #vintagefashion #fashiondaily,1374,266
1203,2025-03-31,Myntra,saree,This floral saree seems to be trending this season.,#fashiondaily #kurtistyle,1637,141
1204,2025-11-19,Instagram,tshirt,The tshirt looks good but the cotton quality feels cheap.,#ootd #styleblog,4348,267
1205,2025-06-10,Instagram,hoodie,I really love this loose fit dark hoodie. The cotton material feels amazing.,#denimtrend #styleblog,1978,239
1206,2025-12-04,Instagram,kurti,This printed kurti looks stunning and the cotton quality is great.,#outfitinspo #ethnicwear #kurtistyle #winterstyle,1172,128
1207,2024-11-30,Twitter,handbag,This green handbag is trending everywhere right now.,#trendalert #pastelfashion #vintagefashion #outfitinspo,4253,128
1208,2024-09-14,Pinterest,hoodie,This green hoodie is trending everywhere right now.,#summerfashion #vintagefashion #minimalstyle #kurtistyle,2190,6
1209,2024-04-16,Reddit,hoodie,Totally obsessed with this minimal hoodie. Perfect for everyday outfits.,#trendalert #ootd,1196,53
1210,2024-11-12,Myntra,tshirt,I noticed many people wearing slim fit tshirt lately.,#styleblog #ethnicwear,2963,259
1211,2025-03-18,Myntra,tshirt,The polyester fabric makes this tshirt super comfortable.,#vintagefashion #ethnicwear #minimalstyle #winterstyle #trendalert,749,50
1212,2025-04-06,Twitter,handbag,Totally obsessed with this vintage handbag. Perfect for everyday outfits.,#minimalstyle #summerfashion,4444,215
1213,2025-12-13,Instagram,dress,This embroidered dress seems to be trending this season.,#pastelfashion #styleblog #ethnicwear,1426,203
1214,2024-06-20,Twitter,streetwear,Seeing lots of white streetwear styles on social media recently.,#ethnicwear #summerfashion #styleblog #kurtistyle,1066,119
1215,2024-02-21,Pinterest,kurti,The silk fabric makes this kurti super comfortable.,#fashiondaily #styleblog #pastelfashion,3722,164
1216,2025-10-19,Pinterest,hoodie,I noticed many people wearing oversized hoodie lately.,#oversizedhoodie #kurtistyle #winterstyle,4740,67
1217,2025-10-08,Pinterest,saree,This beige saree looked better online than in real life.,#outfitinspo #styleblog,4964,79
1218,2024-06-15,Myntra,streetwear,This white streetwear is trending everywhere right now.,#minimalstyle #pastelfashion #ootd,2534,184
1219,2024-10-10,Twitter,dress,I noticed many people wearing modern dress lately.,#oversizedhoodie #streetwear #denimtrend #outfitinspo,4852,235
1220,2025-04-12,Instagram,jacket,This pink jacket looked better online than in real life.,#minimalstyle #pastelfashion #ootd #vintagefashion #fashiondaily,940,177
1221,2025-07-20,Myntra,hoodie,This plain hoodie looks stunning and the cotton quality is great.,#denimtrend #ootd #pastelfashion #kurtistyle,3665,88
1222,2025-06-17,Reddit,hoodie,I expected better from this slim fit hoodie. Not very comfortable.,#streetwear #fashiondaily #minimalstyle #summerfashion,1835,231
