id,date,platform,category,text,hashtags,likes,replies
1394,2025-05-18,Pinterest,hoodie,The cotton fabric makes this hoodie super comfortable.,#outfitinspo #kurtistyle #denimtrend,3896,291
1395,2025-01-29,Instagram,handbag,This white handbag is trending everywhere right now.,#kurtistyle #minimalstyle #trendalert #oversizedhoodie,1912,219
1396,2025-09-21,Amazon,streetwear,This silk streetwear might become popular soon.,#minimalstyle #streetwear #ethnicwear #styleblog #denimtrend #ootd,4177,124
1397,2025-07-05,Twitter,tshirt,This linen tshirt might become popular soon.,#trendalert #outfitinspo #denimtrend #kurtistyle,2421,57
1398,2024-01-13,Twitter,dress,The cotton fabric makes this dress super comfortable.,#fashiondaily #winterstyle #oversizedhoodie #trendalert #vintagefashion,2044,217
1399,2024-07-21,Pinterest,streetwear,I expected better from this oversized streetwear. Not very comfortable.,#winterstyle #denimtrend #oversizedhoodie #outfitinspo #trendalert #streetwear,4739,143
1400,2025-07-17,Instagram,jacket,I really love this loose fit blue jacket. The polyester material feels amazing.,#ethnicwear #denimtrend,3356,8
1401,2025-08-24,Reddit,handbag,Totally obsessed with this modern handbag. Perfect for everyday outfits.,#styleblog #pastelfashion,374,289
1402,2025-02-10,Twitter,handbag,The plain design feels outdated to me.,#denimtrend #ethnicwear #vintagefashion #pastelfashion #oversizedhoodie #fashiondaily,2033,177
1403,2025-10-27,Reddit,streetwear,This embroidered streetwear looks stunning and the wool quality is great.,#outfitinspo #styleblog #summerfashion #streetwear #trendalert #pastelfashion,3152,189
1404,2025-06-01,Instagram,tshirt,I really love this oversized dark tshirt. The cotton material feels amazing.,#kurtistyle #summerfashion #styleblog #ethnicwear #winterstyle,2883,63
1405,2024-05-03,Twitter,dress,The wool fabric makes this dress super comfortable.,#outfitinspo #summerfashion #kurtistyle,781,57
1406,2025-02-21,Reddit,streetwear,I expected better from this loose fit streetwear. Not very comfortable.,#oversizedhoodie #outfitinspo,4793,257
1407,2024-01-12,Pinterest,streetwear,Totally obsessed with this minimal streetwear. Perfect for everyday outfits.,#ethnicwear #streetwear #denimtrend #winterstyle #outfitinspo,2863,31
1408,2025-11-14,Twitter,streetwear,This floral streetwear looks stunning and the polyester quality is great.,#denimtrend #minimalstyle #outfitinspo #kurtistyle,4494,232
1409,2024-11-23,Pinterest,hoodie,This polyester hoodie might become popular soon.,#styleblog #denimtrend #summerfashion #minimalstyle #trendalert,869,191
1410,2025-08-31,Amazon,saree,Totally obsessed with this loose fit saree. Perfect for everyday outfits.,#ootd #oversizedhoodie #winterstyle #denimtrend #trendalert,4265,255
1411,2024-08-25,Myntra,saree,I really love this oversized pastel saree. The wool material feels amazing.,#trendalert #summerfashion #streetwear #oversizedhoodie,3224,94
1412,2024-06-16,Amazon,tshirt,The fabric of this tshirt wrinkles too easily.,#winterstyle #summerfashion #trendalert,4440,109
1413,2024-08-07,Reddit,kurti,Seeing lots of blue kurti styles on social media recently.,#winterstyle #oversizedhoodie #pastelfashion #minimalstyle #styleblog,4702,244
1414,2024-04-16,Pinterest,tshirt,This polyester tshirt might become popular soon.,#streetwear #styleblog #ethnicwear,3799,1
1415,2024-04-26,Instagram,hoodie,This black hoodie looked better online than in real life.,#ethnicwear #winterstyle #ootd,1065,63
1416,2025-04-28,Twitter,jacket,This polyester jacket might become popular soon.,#minimalstyle #summerfashion #winterstyle #kurtistyle #trendalert,3910,298
1417,2024-04-17,Twitter,tshirt,This polyester tshirt might become popular soon.,#oversizedhoodie #trendalert #kurtistyle,3561,91
1418,2024-04-14,Myntra,jacket,I noticed many people wearing modern jacket lately.,#pastelfashion #ootd,3190,60
1419,2025-02-23,Instagram,tshirt,This polyester tshirt might become popular soon.,#styleblog #outfitinspo,681,57
1420,2024-12-10,Myntra,dress,Seeing lots of neon dress styles on social media recently.,#summerfashion #pastelfashion,3652,290
1421,2025-05-16,Instagram,streetwear,I expected better from this vintage streetwear. Not very comfortable.,#kurtistyle #minimalstyle #summerfashion #ootd #streetwear,3704,96
1422,2025-03-13,Instagram,jacket,This silk jacket might become popular soon.,#ethnicwear #styleblog,2111,232
1423,2025-10-16,Instagram,kurti,I expected better from this vintage kurti. Not very comfortable.,#winterstyle #minimalstyle #kurtistyle #styleblog,2440,248
1424,2025-06-13,Myntra,hoodie,The plain design feels outdated to me.,#ethnicwear #fashiondaily #outfitinspo #winterstyle #streetwear #pastelfashion,2704,228
1425,2024-01-17,Twitter,saree,Fashion influencers are posting about loose fit saree again.,#streetwear #summerfashion,4536,187
1426,2025-10-01,Amazon,kurti,This blue kurti looked better online than in real life.,#trendalert #summerfashion #fashiondaily,191,151
1427,2025-04-17,Twitter,saree,This silk saree might become popular soon.,#minimalstyle #outfitinspo #summerfashion #denimtrend #ootd #styleblog,2007,233
1428,2025-05-11,Amazon,handbag,Fashion influencers are posting about loose fit handbag again.,#trendalert #minimalstyle #summerfashion #fashiondaily,3426,174
1429,2024-05-13,Pinterest,jacket,I noticed many people wearing modern jacket lately.,#fashiondaily #ethnicwear,542,224
1430,2024-07-03,Amazon,hoodie,The striped design feels outdated to me.,#streetwear #summerfashion #trendalert #fashiondaily #pastelfashion #minimalstyle,1805,207
1431,2025-03-22,Pinterest,handbag,This striped handbag seems to be trending this season.,#minimalstyle #winterstyle #trendalert #fashiondaily #vintagefashion,4996,168
1432,2024-08-14,Myntra,jacket,This polyester jacket might become popular soon.,#kurtistyle #vintagefashion #denimtrend,4749,26
1433,2024-06-20,Amazon,tshirt,The fabric of this tshirt wrinkles too easily.,#styleblog #streetwear,1167,118
1434,2024-05-07,Reddit,tshirt,This embroidered tshirt seems to be trending this season.,#minimalstyle #streetwear #pastelfashion #outfitinspo,3549,227
1435,2024-03-14,Twitter,hoodie,The floral design feels outdated to me.,#summerfashion #vintagefashion,3848,64
1436,2025-09-24,Reddit,jacket,The linen fabric makes this jacket super comfortable.,#fashiondaily #outfitinspo #oversizedhoodie #ethnicwear #kurtistyle #vintagefashion,4866,258
1437,2024-11-13,Myntra,dress,This blue dress is trending everywhere right now.,#fashiondaily #vintagefashion,3700,246
1438,2024-11-24,Myntra,tshirt,The tshirt looks good but the cotton quality feels cheap.,#ethnicwear #summerfashion #ootd #outfitinspo,2421,203
1439,2024-03-30,Instagram,streetwear,This pastel streetwear looked better online than in real life.,#minimalstyle #fashiondaily #ootd #styleblog #oversizedhoodie,1209,161
1440,2025-01-22,Reddit,streetwear,This black streetwear looked better online than in real life.,#denimtrend #pastelfashion #streetwear #summerfashion,1490,125
1441,2025-06-17,Pinterest,streetwear,I expected better from this oversized streetwear. Not very comfortable.,#denimtrend #pastelfashion #trendalert #ethnicwear #minimalstyle,3235,151
1442,2025-03-27,Reddit,dress,The denim fabric makes this dress super comfortable.,#trendalert #winterstyle,1942,290
1443,2025-04-16,Reddit,saree,I expected better from this loose fit saree. Not very comfortable.,#kurtistyle #minimalstyle #ootd #outfitinspo,3829,252
1444,2025-02-17,Twitter,tshirt,The printed design feels outdated to me.,#fashiondaily #streetwear #trendalert,821,115
1445,2025-05-09,Pinterest,dress,The dress looks good but the polyester quality feels cheap.,#ootd #ethnicwear #outfitinspo,742,111
1446,2025-03-31,Pinterest,handbag,This polyester handbag might become popular soon.,#oversizedhoodie #summerfashion #ethnicwear #styleblog #trendalert,1251,152
1447,2025-01-08,Myntra,saree,I really love this modern green saree. The denim material feels amazing.,#kurtistyle #vintagefashion #ethnicwear #oversizedhoodie,1390,219
1448,2024-01-12,Pinterest,hoodie,Totally obsessed with this minimal hoodie. Perfect for everyday outfits.,#winterstyle #trendalert #ootd #vintagefashion #ethnicwear,944,33
1449,2025-11-29,Instagram,tshirt,Totally obsessed with this slim fit tshirt. Perfect for everyday outfits.,#kurtistyle #winterstyle #fashiondaily,4128,106
1450,2024-06-08,Amazon,handbag,The fabric of this handbag wrinkles too easily.,#winterstyle #kurtistyle,2232,245
1451,2025-03-24,Instagram,kurti,I really love this slim fit dark kurti. The denim material feels amazing.,#pastelfashion #fashiondaily #styleblog #oversizedhoodie #ootd,4467,255
1452,2024-05-08,Instagram,saree,This polyester saree might become popular soon.,#styleblog #summerfashion #denimtrend #pastelfashion #fashiondaily,302,21
1453,2025-05-04,Amazon,kurti,This floral kurti seems to be trending this season.,#fashiondaily #ootd #denimtrend,2492,186
1454,2024-10-04,Reddit,kurti,This silk kurti might become popular soon.,#kurtistyle #outfitinspo #minimalstyle,4529,25
1455,2025-06-06,Reddit,tshirt,This pastel tshirt looked better online than in real life.,#ootd #oversizedhoodie #styleblog,3921,32
1456,2024-05-02,Twitter,tshirt,The tshirt looks good but the cotton quality feels cheap.,#fashiondaily #ootd #minimalstyle #styleblog #kurtistyle #vintagefashion,739,12
1457,2025-07-14,Instagram,streetwear,Fashion influencers are posting about loose fit streetwear again.,#trendalert #fashiondaily,2230,97
1458,2025-09-09,Pinterest,dress,The striped design feels outdated to me.,#trendalert #minimalstyle #fashiondaily #pastelfashion #summerfashion,2018,165
1459,2025-03-06,Pinterest,dress,The dress looks good but the wool quality feels cheap.,#streetwear #oversizedhoodie #ethnicwear #kurtistyle,2944,0
1460,2025-03-21,Twitter,saree,Totally obsessed with this minimal saree. Perfect for everyday outfits.,#fashiondaily #winterstyle #pastelfashion,2850,133
1461,2025-07-23,Instagram,dress,The fabric of this dress wrinkles too easily.,#kurtistyle #vintagefashion #styleblog #ootd #winterstyle #outfitinspo,4918,138
1462,2024-02-04,Instagram,streetwear,Totally obsessed with this minimal streetwear. Perfect for everyday outfits.,#outfitinspo #ootd,555,16
1463,2024-05-22,Twitter,kurti,This printed kurti seems to be trending this season.,#ethnicwear #summerfashion #vintagefashion,1836,58
1464,2024-03-10,Reddit,saree,The polyester fabric makes this saree super comfortable.,#ootd #minimalstyle #denimtrend #summerfashion,1970,225
1465,2025-06-01,Amazon,saree,Seeing lots of black saree styles on social media recently.,#kurtistyle #winterstyle #denimtrend #trendalert #vintagefashion #ootd,1580,300
1466,2025-01-04,Twitter,kurti,I really love this minimal blue kurti. The denim material feels amazing.,#pastelfashion #vintagefashion #kurtistyle,4659,79
1467,2025-08-13,Myntra,tshirt,This silk tshirt might become popular soon.,#ootd #streetwear #outfitinspo,862,59
1468,2024-03-18,Instagram,dress,This embroidered dress seems to be trending this season.,#oversizedhoodie #kurtistyle,1732,186
1469,2024-05-28,Instagram,tshirt,Seeing lots of black tshirt styles on social media recently.,#minimalstyle #streetwear,3730,297
1470,2025-09-01,Amazon,hoodie,The fabric of this hoodie wrinkles too easily.,#denimtrend #minimalstyle #ethnicwear #winterstyle #styleblog #fashiondaily,123,171
1471,2024-07-30,Reddit,tshirt,I expected better from this modern tshirt. Not very comfortable.,#ethnicwear #kurtistyle #denimtrend #outfitinspo #vintagefashion,574,181
1472,2025-11-18,Myntra,dress,This silk dress might become popular soon.,#kurtistyle #vintagefashion #minimalstyle #ethnicwear #denimtrend,4616,156
1473,2025-11-27,Instagram,tshirt,This embroidered tshirt looks stunning and the denim quality is great.,#fashiondaily #oversizedhoodie #winterstyle #pastelfashion,749,266
1474,2025-01-07,Pinterest,saree,The saree looks good but the wool quality feels cheap.,#vintagefashion #kurtistyle #styleblog #denimtrend,539,297
1475,2024-06-12,Twitter,kurti,This printed kurti looks stunning and the polyester quality is great.,#minimalstyle #vintagefashion #summerfashion #winterstyle #ethnicwear,2385,248
1476,2024-12-16,Pinterest,hoodie,This striped hoodie seems to be trending this season.,#ethnicwear #vintagefashion,2721,95
1477,2025-03-22,Myntra,handbag,The fabric of this handbag wrinkles too easily.,#kurtistyle #pastelfashion #ootd #oversizedhoodie,3075,203
1478,2024-07-26,Amazon,jacket,Seeing lots of pastel jacket styles on social media recently.,#fashiondaily #streetwear,4777,15
1479,2025-09-26,Amazon,dress,The floral design feels outdated to me.,#denimtrend #summerfashion #styleblog #trendalert #vintagefashion #pastelfashion,4453,173
1480,2024-03-30,Twitter,jacket,The fabric of this jacket wrinkles too easily.,#oversizedhoodie #ootd #trendalert #ethnicwear,4848,134
1481,2024-06-16,Amazon,kurti,The silk fabric makes this kurti super comfortable.,#winterstyle #streetwear #trendalert #styleblog #vintagefashion #denimtrend,3105,50
1482,2024-01-28,Myntra,hoodie,I noticed many people wearing loose fit hoodie lately.,#pastelfashion #fashiondaily #winterstyle #trendalert #minimalstyle #outfitinspo,3585,50
1483,2025-07-23,Reddit,jacket,This embroidered jacket looks stunning and the polyester quality is great.,#trendalert #minimalstyle,4142,90
1484,2024-12-30,Pinterest,kurti,The fabric of this kurti wrinkles too easily.,#summerfashion #winterstyle #minimalstyle #trendalert #ootd #styleblog,4238,105
1485,2024-08-22,Twitter,handbag,The wool fabric makes this handbag super comfortable.,#streetwear #pastelfashion #vintagefashion #kurtistyle,4617,32
1486,2025-03-11,Instagram,dress,This embroidered dress looks stunning and the silk quality is great.,#pastelfashion #oversizedhoodie,858,215
1487,2025-11-22,Reddit,streetwear,This white streetwear is trending everywhere right now.,#denimtrend #styleblog,2663,126
1488,2024-04-13,Reddit,tshirt,This printed tshirt seems to be trending this season.,#streetwear #trendalert,3247,197
1489,2024-02-24,Amazon,handbag,Totally obsessed with this minimal handbag. Perfect for everyday outfits.,#kurtistyle #styleblog #summerfashion #trendalert #oversizedhoodie,1429,232
1490,2025-10-31,Reddit,saree,The saree looks good but the linen quality feels cheap.,#oversizedhoodie #ootd #fashiondaily,2276,97
1491,2025-01-07,Amazon,handbag,Totally obsessed with this loose fit handbag. Perfect for everyday outfits.,#trendalert #pastelfashion #fashiondaily #summerfashion,2559,264
1492,2025-10-12,Pinterest,kurti,I expected better from this modern kurti. Not very comfortable.,#ethnicwear #fashiondaily,3960,40
1493,2025-04-19,Reddit,streetwear,This printed streetwear seems to be trending this season.,#pastelfashion #winterstyle #trendalert,3954,260
1494,2025-05-10,Myntra,saree,Totally obsessed with this minimal saree. Perfect for everyday outfits.,#kurtistyle #winterstyle #oversizedhoodie #streetwear #fashiondaily #denimtrend,4142,113
1495,2024-11-18,Amazon,streetwear,This plain streetwear looks stunning and the polyester quality is great.,#outfitinspo #minimalstyle #styleblog #ootd #kurtistyle,2611,143
1496,2024-12-17,Amazon,saree,The denim fabric makes this saree super comfortable.,#minimalstyle #summerfashion,4721,77
1497,2025-04-03,Reddit,tshirt,I really love this vintage dark tshirt. The silk material feels amazing.,#ootd #streetwear #oversizedhoodie,477,87
1498,2025-05-31,Myntra,tshirt,This printed tshirt seems to be trending this season.,#ethnicwear #streetwear #fashiondaily,327,133
1499,2024-03-02,Amazon,tshirt,Seeing lots of white tshirt styles on social media recently.,#kurtistyle #outfitinspo #vintagefashion #ootd,2628,234
1500,2025-04-09,Twitter,streetwear,The streetwear looks good but the cotton quality feels cheap.,#kurtistyle #fashiondaily,459,250
1501,2025-07-30,Myntra,tshirt,The tshirt looks good but the denim quality feels cheap.,#pastelfashion #fashiondaily,2900,276
1502,2025-12-29,Pinterest,hoodie,Totally obsessed with this vintage hoodie. Perfect for everyday outfits.,#denimtrend #minimalstyle #outfitinspo #pastelfashion #summerfashion #kurtistyle,1331,275
1503,2024-03-27,Amazon,streetwear,I really love this loose fit neon streetwear. The linen material feels amazing.,#ootd #winterstyle #oversizedhoodie #outfitinspo #ethnicwear,958,169
1504,2024-01-13,Reddit,kurti,I expected better from this oversized kurti. Not very comfortable.,#pastelfashion #minimalstyle #ethnicwear,2881,53
1505,2024-12-03,Reddit,handbag,The fabric of this handbag wrinkles too easily.,#outfitinspo #kurtistyle #trendalert #pastelfashion,1887,275
1506,2024-07-08,Pinterest,jacket,Fashion influencers are posting about modern jacket again.,#vintagefashion #minimalstyle #denimtrend #pastelfashion,702,89
1507,2025-06-01,Instagram,tshirt,Fashion influencers are posting about oversized tshirt again.,#streetwear #fashiondaily,1204,188
1508,2024-06-30,Pinterest,dress,This neon dress is trending everywhere right now.,#denimtrend #minimalstyle #streetwear #outfitinspo #winterstyle,2786,61
1509,2025-08-17,Twitter,dress,This wool dress might become popular soon.,#trendalert #ootd #ethnicwear #denimtrend #styleblog #fashiondaily,4306,209
1510,2024-06-28,Myntra,saree,The fabric of this saree wrinkles too easily.,#fashiondaily #minimalstyle #ethnicwear #oversizedhoodie #summerfashion #denimtrend,1795,217
1511,2024-10-14,Pinterest,kurti,Seeing lots of black kurti styles on social media recently.,#oversizedhoodie #vintagefashion #summerfashion #winterstyle #fashiondaily #styleblog,3447,298
1512,2024-02-10,Reddit,dress,Seeing lots of blue dress styles on social media recently.,#minimalstyle #outfitinspo #denimtrend #oversizedhoodie,473,297
1513,2025-08-23,Myntra,hoodie,I noticed many people wearing loose fit hoodie lately.,#denimtrend #ootd,3795,34
1514,2024-09-04,Instagram,streetwear,This dark streetwear is trending everywhere right now.,#denimtrend #ootd #summerfashion #vintagefashion #minimalstyle #ethnicwear,4294,68
1515,2025-01-07,Twitter,tshirt,This green tshirt is trending everywhere right now.,#trendalert #streetwear #winterstyle,69,124
1516,2024-09-27,Myntra,jacket,I really love this vintage green jacket. The denim material feels amazing.,#outfitinspo #streetwear #ootd #ethnicwear,722,199
1517,2025-01-19,Reddit,saree,I noticed many people wearing oversized saree lately.,#styleblog #outfitinspo #vintagefashion #kurtistyle #ootd #streetwear,1024,291
1518,2024-09-25,Twitter,kurti,Seeing lots of blue kurti styles on social media recently.,#denimtrend #summerfashion #ethnicwear,3882,115
1519,2025-01-29,Pinterest,saree,I expected better from this slim fit saree. Not very comfortable.,#ethnicwear #fashiondaily,3557,97
1520,2024-12-30,Pinterest,tshirt,The plain design feels outdated to me.,#outfitinspo #pastelfashion #winterstyle #denimtrend,4771,192
1521,2025-01-10,Pinterest,streetwear,This embroidered streetwear seems to be trending this season.,#oversizedhoodie #ootd #styleblog #summerfashion #minimalstyle,1538,157
1522,2024-10-24,Pinterest,streetwear,This cotton streetwear might become popular soon.,#summerfashion #streetwear #denimtrend,4191,279
1523,2025-12-09,Twitter,dress,The embroidered design feels outdated to me.,#trendalert #ootd #streetwear #outfitinspo #minimalstyle,4293,251
1524,2025-07-26,Amazon,dress,The silk fabric makes this dress super comfortable.,#pastelfashion #denimtrend,3692,68
1525,2024-02-01,Instagram,tshirt,This beige tshirt looked better online than in real life.,#trendalert #ethnicwear,2354,5
1526,2025-03-03,Reddit,hoodie,Totally obsessed with this modern hoodie. Perfect for everyday outfits.,#styleblog #fashiondaily #trendalert #ootd #denimtrend,812,101
1527,2025-12-08,Myntra,tshirt,This floral tshirt looks stunning and the denim quality is great.,#ethnicwear #winterstyle #minimalstyle #pastelfashion #ootd #styleblog,4761,165
1528,2024-07-13,Twitter,hoodie,This striped hoodie looks stunning and the wool quality is great.,#denimtrend #outfitinspo,3101,243
1529,2024-11-22,Reddit,saree,This floral saree seems to be trending this season.,#vintagefashion #ethnicwear #ootd,4567,97
1530,2025-11-15,Pinterest,handbag,I really love this vintage white handbag. The linen material feels amazing.,#ootd #streetwear #ethnicwear #styleblog,2833,117
1531,2024-06-14,Pinterest,hoodie,The hoodie looks good but the linen quality feels cheap.,#minimalstyle #vintagefashion,942,30
1532,2025-05-20,Myntra,dress,I noticed many people wearing loose fit dress lately.,#outfitinspo #fashiondaily #denimtrend #pastelfashion #vintagefashion #winterstyle,3067,179
1533,2024-06-09,Instagram,kurti,Totally obsessed with this minimal kurti. Perfect for everyday outfits.,#oversizedhoodie #denimtrend #vintagefashion #pastelfashion #kurtistyle,886,75
1534,2024-07-02,Instagram,saree,This striped saree looks stunning and the silk quality is great.,#outfitinspo #styleblog #winterstyle #vintagefashion #fashiondaily #summerfashion,3287,59
1535,2024-04-08,Reddit,streetwear,The fabric of this streetwear wrinkles too easily.,#minimalstyle #winterstyle #oversizedhoodie #ethnicwear #streetwear,3469,114
1536,2024-11-03,Instagram,jacket,This neon jacket looked better online than in real life.,#pastelfashion #ethnicwear #minimalstyle #kurtistyle,4617,31
1537,2025-03-26,Pinterest,hoodie,This embroidered hoodie looks stunning and the wool quality is great.,#kurtistyle #outfitinspo #summerfashion #styleblog,3690,273
1538,2024-09-10,Pinterest,hoodie,The plain design feels outdated to me.,#denimtrend #pastelfashion #fashiondaily #vintagefashion #streetwear #kurtistyle,2549,22
1539,2024-08-21,Twitter,kurti,This printed kurti looks stunning and the cotton quality is great.,#vintagefashion #winterstyle #minimalstyle #pastelfashion #kurtistyle,909,31
1540,2025-08-25,Twitter,streetwear,I expected better from this loose fit streetwear. Not very comfortable.,#minimalstyle #streetwear #trendalert #denimtrend #summerfashion,1022,85
1541,2025-07-24,Instagram,dress,Seeing lots of white dress styles on social media recently.,#summerfashion #trendalert,1115,269
1542,2024-03-28,Reddit,saree,I noticed many people wearing modern saree lately.,#styleblog #ethnicwear #fashiondaily #trendalert #vintagefashion,1223,168
1543,2024-03-02,Amazon,tshirt,The tshirt looks good but the wool quality feels cheap.,#vintagefashion #styleblog #trendalert #outfitinspo #streetwear,1817,290
1544,2024-07-31,Reddit,tshirt,This embroidered tshirt looks stunning and the silk quality is great.,#ootd #styleblog #winterstyle #denimtrend,2599,288
1545,2025-08-17,Instagram,jacket,The plain design feels outdated to me.,#fashiondaily #kurtistyle,3200,207
1546,2024-08-04,Pinterest,tshirt,Seeing lots of pastel tshirt styles on social media recently.,#vintagefashion #trendalert #summerfashion #oversizedhoodie #ethnicwear #minimalstyle,4584,62
1547,2025-12-23,Amazon,kurti,Totally obsessed with this modern kurti. Perfect for everyday outfits.,#pastelfashion #fashiondaily #trendalert #ootd,284,106
1548,2024-01-21,Reddit,handbag,The handbag looks good but the cotton quality feels cheap.,#minimalstyle #kurtistyle,800,16
1549,2024-10-03,Amazon,tshirt,Fashion influencers are posting about minimal tshirt again.,#ootd #winterstyle,4622,146
1550,2024-09-20,Twitter,dress,This striped dress looks stunning and the silk quality is great.,#winterstyle #fashiondaily #summerfashion #oversizedhoodie #outfitinspo,522,4
1551,2025-09-15,Pinterest,kurti,I really love this minimal pink kurti. The denim material feels amazing.,#fashiondaily #ethnicwear #winterstyle #kurtistyle,442,89
1552,2024-10-26,Reddit,handbag,The linen fabric makes this handbag super comfortable.,#ethnicwear #trendalert #summerfashion #outfitinspo #denimtrend,2714,52
1553,2025-08-18,Myntra,saree,Totally obsessed with this modern saree. Perfect for everyday outfits.,#ootd #oversizedhoodie #pastelfashion #fashiondaily #styleblog,536,197
1554,2024-06-26,Instagram,dress,This pink dress looked better online than in real life.,#summerfashion #pastelfashion,4630,62
1555,2024-05-09,Pinterest,kurti,I really love this oversized pink kurti. The silk material feels amazing.,#oversizedhoodie #summerfashion #outfitinspo #fashiondaily,2391,150
1556,2024-05-19,Reddit,kurti,Seeing lots of green kurti styles on social media recently.,#vintagefashion #denimtrend #winterstyle #trendalert,4890,129
1557,2024-08-12,Pinterest,tshirt,This embroidered tshirt looks stunning and the wool quality is great.,#outfitinspo #minimalstyle #winterstyle,3605,160
1558,2024-07-12,Amazon,saree,I expected better from this minimal saree. Not very comfortable.,#kurtistyle #styleblog #fashiondaily,2390,261
1559,2024-01-17,Amazon,kurti,I really love this oversized green kurti. The denim material feels amazing.,#streetwear #fashiondaily #vintagefashion,2242,229
1560,2024-06-11,Amazon,dress,This silk dress might become popular soon.,#outfitinspo #winterstyle #streetwear,268,243
1561,2024-06-02,Instagram,tshirt,The polyester fabric makes this tshirt super comfortable.,#pastelfashion #denimtrend #outfitinspo #winterstyle,3444,180
1562,2024-08-25,Twitter,hoodie,I noticed many people wearing minimal hoodie lately.,#winterstyle #streetwear #oversizedhoodie #ootd #denimtrend,3691,78
1563,2024-06-28,Reddit,saree,The plain design feels outdated to me.,#minimalstyle #winterstyle #oversizedhoodie,5,19
1564,2024-04-01,Myntra,saree,The saree looks good but the polyester quality feels cheap.,#fashiondaily #pastelfashion #minimalstyle #winterstyle #ootd,867,4
1565,2025-04-05,Instagram,hoodie,This wool hoodie might become popular soon.,#ethnicwear #trendalert #pastelfashion #ootd,149,197
1566,2024-06-17,Pinterest,hoodie,I expected better from this oversized hoodie. Not very comfortable.,#ootd #ethnicwear #fashiondaily #styleblog,3270,241
1567,2024-12-13,Pinterest,jacket,This polyester jacket might become popular soon.,#winterstyle #kurtistyle #fashiondaily #oversizedhoodie,2857,199
